{"timestamp":"2025-12-04T17:37:28.146Z","data":[{"wo":"WO17783342","desc":"8291065 ST - FAZER MANUTENÇÃO PONTE RETIFICADORA","date":"02/10/2025","rawDate":"2025-10-02T11:30:00.000Z","activityCode":"","asset":"CRAN-ELPC-261-PR-002","cause":"CORRECTIVE"},{"wo":"17759642","desc":"07D MANUT ELET INSP PREV PINCA LESTE E OESTE - PONTES 261 E 262 (REV23)","date":"04/10/2025","rawDate":"2025-10-04T11:30:00.000Z","activityCode":"Y1ZCRAN-IN-ECL261-PR-261001","asset":"CRAN-ELPC-261-PR-002","cause":"PREVENTIVE"},{"wo":"17759643","desc":"28D MANUT ELET PREV TRANSLAÇÃO PONTE - PONTES 261 e 262 (REV23)","date":"04/10/2025","rawDate":"2025-10-04T11:30:00.000Z","activityCode":"Y1ZCRAN-IN-ECL261-PR-261003","asset":"CRAN-ELPC-261-PR-002","cause":"PREVENTIVE"},{"wo":"17759644","desc":"14D PPSC INSP PREV TESTE INICIAL - ELETRODOS","date":"04/10/2025","rawDate":"2025-10-04T11:30:00.000Z","activityCode":"Y1ZCRAN-IN-ECL261-PR-141F20","asset":"CRAN-ELPC-261-PR-002","cause":"PREVENTIVE"},{"wo":"17759647","desc":"28D MANUT ELET MENSAL PREV DE MOTORES DAS PONTES 261 E 262","date":"04/10/2025","rawDate":"2025-10-04T11:30:00.000Z","activityCode":"Y1ZCRAN-IN-ECL261-PR-141F82","asset":"CRAN-ELPC-261-PR-002","cause":"PREVENTIVE"},{"wo":"17741270","desc":"84D MANUT MEC PREV COMPRESSOR - PONTES 262","date":"04/10/2025","rawDate":"2025-10-04T11:30:00.000Z","activityCode":"Y1ZCRAN-IN-ECL261-PR-141F101","asset":"CRAN-ELPC-261-PR-002","cause":"PREVENTIVE"},{"wo":"17741271","desc":"14D MANUT MEC PREV ELEV DA PINCA DAS PONTES ELETRD","date":"04/10/2025","rawDate":"2025-10-04T11:30:00.000Z","activityCode":"Y1ZCRAN-IN-ECL261-PR-141F22","asset":"CRAN-ELPC-261-PR-002","cause":"PREVENTIVE"},{"wo":"17741272","desc":"14D LUB DA ELEVACAO DA PINCA DE PONTE ROLANTE - 261 E 263","date":"04/10/2025","rawDate":"2025-10-04T11:30:00.000Z","activityCode":"Y1ZCRAN-IN-ECL261-PR-141F30","asset":"CRAN-ELPC-261-PR-002","cause":"PREVENTIVE"},{"wo":"17741273","desc":"56D MANUT MEC PREV FERR. PINÇA - PONTES 261 E 262","date":"04/10/2025","rawDate":"2025-10-04T11:30:00.000Z","activityCode":"Y1ZCRAN-IN-ECL261-PR-141F41","asset":"CRAN-ELPC-261-PR-002","cause":"PREVENTIVE"},{"wo":"17741275","desc":"28D MANUT MEC PREV DESCARGA DE COQUE - PONTES 261 E 262","date":"04/10/2025","rawDate":"2025-10-04T11:30:00.000Z","activityCode":"Y1ZCRAN-IN-ECL261-PR-141F47","asset":"CRAN-ELPC-261-PR-002","cause":"PREVENTIVE"},{"wo":"17741276","desc":"28D MANUT MEC PREV DO COMPRESSOR - PONTES 261","date":"04/10/2025","rawDate":"2025-10-04T11:30:00.000Z","activityCode":"Y1ZCRAN-IN-ECL261-PR-141F80","asset":"CRAN-ELPC-261-PR-002","cause":"PREVENTIVE"},{"wo":"17741277","desc":"28D LUBRIFICACAO DA TRANSLAÇÃO CARRO PINÇA - 261 E 262","date":"04/10/2025","rawDate":"2025-10-04T11:30:00.000Z","activityCode":"Y1ZCRAN-IN-ECL261-PR-141F95","asset":"CRAN-ELPC-261-PR-002","cause":"PREVENTIVE"},{"wo":"WO17790766","desc":"SUBSTITUIR CONTATORES CAD 32, KA 01 , KA 02 E KA 03 DO PAINEL DO SUCCIONADOR\n\nRECURSO MÃO DE OBRA: 02 ELET, 04 HH","date":"04/10/2025","rawDate":"2025-10-04T15:30:00.000Z","activityCode":"","asset":"CRAN-ELPC-261-PR-002","cause":"CORRECTIVE"},{"wo":"WO17790764","desc":"SUBSTITUIR BORNES DANIFICADOS DO PAINEL DO SUCCIONADOR (BORNES DE 6 mm)\n\nRECURSO MÃO DE OBRA: 02 ELET, 04 HH\nMATERIAL: 801116941 - BORNES 6 mm (SOLICITAR 05 UNIDADES)","date":"04/10/2025","rawDate":"2025-10-04T16:00:00.000Z","activityCode":"","asset":"CRAN-ELPC-261-PR-002","cause":"CORRECTIVE"},{"wo":"WO17790765","desc":"SUBSTITUIR LIMITE DE EMERGÊNCIA DA PINÇA LESTE\n\nRECURSO MÃO DE OBRA: 02 ELET, 02 HH\nMATERIAL: 800705667 - LIMITE CRUZETA (01 PÇ)","date":"04/10/2025","rawDate":"2025-10-04T17:30:00.000Z","activityCode":"","asset":"CRAN-ELPC-261-PR-002","cause":"CORRECTIVE"},{"wo":"WO17851868","desc":"EMERG - AR CONDICIONADO SÓ VENTILA","date":"08/10/2025","rawDate":"2025-10-08T03:49:59.999Z","activityCode":"","asset":"CRAN-ELPC-261-PR-002","cause":"CORRECTIVE"},{"wo":"WO17272400","desc":"REPROGRAMADO SUBSTITUIR JOGO DE CONTATO PRINCIPAL TRANSLACAO DO CARRO TREMONHA LESTE E OESTE DO PAINEL N2.\n","date":"11/10/2025","rawDate":"2025-10-11T11:30:00.000Z","activityCode":"","asset":"CRAN-ELPC-261-PR-002","cause":"CORRECTIVE"},{"wo":"WO17430219","desc":"PREVENTIVA GERAL NO COMPRESSOR : TROCAR FILTROS DE AR, FILTRO DE ÓLEO, ELEMENTO SEPARADOR DA AR E ÓLEO E TROCA DE ÓLEO.RECURSO MÃO DE OBRA: 02 MEC, 06 HHMATERIAL:800135950 - NO STAING","date":"11/10/2025","rawDate":"2025-10-11T11:30:00.000Z","activityCode":"","asset":"CRAN-ELPC-261-PR-002","cause":"CORRECTIVE"},{"wo":"17759645","desc":"28D ELETRD MANUT MEC PREV DA SUCÇÃO COQUE - PONTES 261 E 262","date":"11/10/2025","rawDate":"2025-10-11T11:30:00.000Z","activityCode":"Y1ZCRAN-IN-ECL261-PR-141F23","asset":"CRAN-ELPC-261-PR-002","cause":"PREVENTIVE"},{"wo":"17759646","desc":"28D MANUT MEC DA TRANSLACAO CARRO TREMONHA - PONTES 261 E 262","date":"11/10/2025","rawDate":"2025-10-11T11:30:00.000Z","activityCode":"Y1ZCRAN-IN-ECL261-PR-141F45","asset":"CRAN-ELPC-261-PR-002","cause":"PREVENTIVE"},{"wo":"17759648","desc":"28D LUBRIFICACAO DA TRANSLAÇÃO CARRO TREMONHA - 261 E 262","date":"11/10/2025","rawDate":"2025-10-11T11:30:00.000Z","activityCode":"Y1ZCRAN-ELPC-261-PR-001-141F96","asset":"CRAN-ELPC-261-PR-002","cause":"PREVENTIVE"},{"wo":"17759649","desc":"28D LUBRIFICACAO DA FERRAMENTA GUINCHO - 261 E 262","date":"11/10/2025","rawDate":"2025-10-11T11:30:00.000Z","activityCode":"Y1ZCRAN-IN-ECL261-PR-141F97","asset":"CRAN-ELPC-261-PR-002","cause":"PREVENTIVE"},{"wo":"17759729","desc":"28D MANUT ELET PREV DA  FERRAMENTA GUINCHO DAS PONTES (261)","date":"11/10/2025","rawDate":"2025-10-11T11:30:00.000Z","activityCode":"Y1ZCRAN-IN-ECL261-PR-141F90","asset":"CRAN-ELPC-261-PR-002","cause":"PREVENTIVE"},{"wo":"17769747","desc":"07D MANUT ELET INSP PREV PINCA LESTE E OESTE - PONTES 261 E 262 (REV23)","date":"11/10/2025","rawDate":"2025-10-11T11:30:00.000Z","activityCode":"Y1ZCRAN-IN-ECL261-PR-261001","asset":"CRAN-ELPC-261-PR-002","cause":"PREVENTIVE"},{"wo":"17769748","desc":"14D MANUT ELET PREV DA DESCARGA E SUCCIONADOR PONTES 261 E 262 (REV23)","date":"11/10/2025","rawDate":"2025-10-11T11:30:00.000Z","activityCode":"Y1ZCRAN-IN-ECL261-PR-261002","asset":"CRAN-ELPC-261-PR-002","cause":"PREVENTIVE"},{"wo":"17769754","desc":"28D MANUT ELET PREV DO PANTÓGRAFO - PONTES 261 E 262","date":"11/10/2025","rawDate":"2025-10-11T11:30:00.000Z","activityCode":"Y1ZCRAN-IN-ECL261-PR-141F81","asset":"CRAN-ELPC-261-PR-002","cause":"PREVENTIVE"},{"wo":"17820158","desc":"56D PREVENTIVA ELETR DE TRANSLACAO CARRO PINCA","date":"11/10/2025","rawDate":"2025-10-11T11:30:00.000Z","activityCode":"Y1ZCRAN-IN-ECL261-PR-141F89","asset":"CRAN-ELPC-261-PR-002","cause":"PREVENTIVE"},{"wo":"17794418","desc":"35D MANUT ELET MENSAL PREV DE MOTORES DAS PONTES 261 E 262 (REV23)","date":"11/10/2025","rawDate":"2025-10-11T11:30:00.000Z","activityCode":"Y1ZCRAN-IN-ECL261-PR-261006","asset":"CRAN-ELPC-261-PR-002","cause":"PREVENTIVE"},{"wo":"17794423","desc":"28D MANUT MEC PREV DESCARGA DE COQUE - PONTES 261 E 262","date":"11/10/2025","rawDate":"2025-10-11T11:30:00.000Z","activityCode":"Y1ZCRAN-IN-ECL261-PR-141F47","asset":"CRAN-ELPC-261-PR-002","cause":"PREVENTIVE"},{"wo":"WO17782507","desc":"MANUTENÇÃO ELÉTRICA PREVENTIVA CIRCUITO ELÉTRICO DO 7 Hz\n\n\nRECURSO MÃO DE OBRA: 02 ELET, 06 HH","date":"11/10/2025","rawDate":"2025-10-11T11:34:00.000Z","activityCode":"","asset":"CRAN-ELPC-261-PR-002","cause":"CORRECTIVE"},{"wo":"17780692","desc":"28D AI RED INSPECAO MEC CABO DE ACO E GANCHO","date":"15/10/2025","rawDate":"2025-10-15T11:00:00.000Z","activityCode":"Y1ZINFR-IN-INSPMC-AI-RED-0003","asset":"CRAN-ELPC-261-PR-002","cause":"PREVENTIVE"},{"wo":"WO17870988","desc":"EMERG - AR CONDICIONADO SÓ VENTILA","date":"17/10/2025","rawDate":"2025-10-17T05:45:00.000Z","activityCode":"","asset":"CRAN-ELPC-261-PR-002","cause":"CORRECTIVE"},{"wo":"WO17814898","desc":"8305774 ST - PONTE RETIFICADORA EM CURTO","date":"17/10/2025","rawDate":"2025-10-17T11:30:00.000Z","activityCode":"","asset":"CRAN-ELPC-261-PR-002","cause":"CORRECTIVE"},{"wo":"17781795","desc":"28D MANUT ELET PREV DA  FERRAMENTA GUINCHO DAS PONTES (261)","date":"18/10/2025","rawDate":"2025-10-18T11:30:00.000Z","activityCode":"Y1ZCRAN-IN-ECL261-PR-141F90","asset":"CRAN-ELPC-261-PR-002","cause":"PREVENTIVE"},{"wo":"17781805","desc":"07D MANUT ELET INSP PREV PINCA LESTE E OESTE - PONTES 261 E 262 (REV23)","date":"18/10/2025","rawDate":"2025-10-18T11:30:00.000Z","activityCode":"Y1ZCRAN-IN-ECL261-PR-261001","asset":"CRAN-ELPC-261-PR-002","cause":"PREVENTIVE"},{"wo":"17781806","desc":"14D MANUT ELET PREV DA DESCARGA E SUCCIONADOR PONTES 261 E 262 (REV23)","date":"18/10/2025","rawDate":"2025-10-18T11:30:00.000Z","activityCode":"Y1ZCRAN-IN-ECL261-PR-261002","asset":"CRAN-ELPC-261-PR-002","cause":"PREVENTIVE"},{"wo":"17781807","desc":"14D PPSC INSP PREV TESTE INICIAL - ELETRODOS","date":"18/10/2025","rawDate":"2025-10-18T11:30:00.000Z","activityCode":"Y1ZCRAN-IN-ECL261-PR-141F20","asset":"CRAN-ELPC-261-PR-002","cause":"PREVENTIVE"},{"wo":"17835432","desc":"28D MANUT ELET PREV DA  FERRAMENTA GUINCHO DAS PONTES (261)","date":"18/10/2025","rawDate":"2025-10-18T11:30:00.000Z","activityCode":"Y1ZCRAN-IN-ECL261-PR-141F90","asset":"CRAN-ELPC-261-PR-002","cause":"PREVENTIVE"},{"wo":"WO16873060","desc":"INSPECIONAR RODA GUIA TRANSLACAO PONTE LADO SUL - CASO SEJA PARA REALIZAR TROCA ABRIR ST E ENVIAR PARA KARLA ROCHA COD 800529290\n","date":"18/10/2025","rawDate":"2025-10-18T11:30:00.000Z","activityCode":"","asset":"CRAN-ELPC-261-PR-002","cause":"CORRECTIVE"},{"wo":"WO17363019","desc":"SUBSTITUIR CONJUNTO DE FILTRO DE AR DE 1\" DAS VALVULAS TIME QNT: 02 PEÇAS +02 NIPLES DE 1\" NPT\n\nRECURSO MAO DE OBRA: 02 MEC, 03 HH\nMATERIAL: \n800557188 - FILTRO DE AR (02 UNIDADE)\n800021156 - NIPLE (SOLICITAR 02 UNIDADES)\n","date":"18/10/2025","rawDate":"2025-10-18T11:30:00.000Z","activityCode":"","asset":"CRAN-ELPC-261-PR-002","cause":"CORRECTIVE"},{"wo":"17769749","desc":"14D MANUT MEC PREV ELEV DA PINCA DAS PONTES ELETRD","date":"18/10/2025","rawDate":"2025-10-18T11:30:00.000Z","activityCode":"Y1ZCRAN-IN-ECL261-PR-141F22","asset":"CRAN-ELPC-261-PR-002","cause":"PREVENTIVE"},{"wo":"17769750","desc":"28D MANUTENÇÃO CABINE DA PONTES 261 E 262","date":"18/10/2025","rawDate":"2025-10-18T11:30:00.000Z","activityCode":"Y1ZCRAN-IN-ECL261-PR-141F28","asset":"CRAN-ELPC-261-PR-002","cause":"PREVENTIVE"},{"wo":"17769751","desc":"14D LUB DA ELEVACAO DA PINCA DE PONTE ROLANTE - 261 E 263","date":"18/10/2025","rawDate":"2025-10-18T11:30:00.000Z","activityCode":"Y1ZCRAN-IN-ECL261-PR-141F30","asset":"CRAN-ELPC-261-PR-002","cause":"PREVENTIVE"},{"wo":"17769752","desc":"14D MANUT MEC PREV DOS GUINCHOS DAS PONTES ELETRODOS","date":"18/10/2025","rawDate":"2025-10-18T11:30:00.000Z","activityCode":"Y1ZCRAN-IN-ECL261-PR-141F44","asset":"CRAN-ELPC-261-PR-002","cause":"PREVENTIVE"},{"wo":"17769753","desc":"28D MANUT MEC PREV DO COMPRESSOR - PONTES 261","date":"18/10/2025","rawDate":"2025-10-18T11:30:00.000Z","activityCode":"Y1ZCRAN-IN-ECL261-PR-141F80","asset":"CRAN-ELPC-261-PR-002","cause":"PREVENTIVE"},{"wo":"17769755","desc":"28D LUBRIFICACAO DA TRANSLAÇÃO PONTE - 261 E 262","date":"18/10/2025","rawDate":"2025-10-18T11:30:00.000Z","activityCode":"Y1ZCRAN-IN-ECL261-PR-141F94","asset":"CRAN-ELPC-261-PR-002","cause":"PREVENTIVE"},{"wo":"WO17480128","desc":"VERIFICAR INTEGRIDADE DOS CABOS E LIGAÇÃO DOS FREIOS DA PONTE: ELEVAÇÃO PINÇA, GUINCHO DE 20 T E 5 T, ABERTURA E FECHAMENTO DAS PINÇAS.\n\nRECURSO MÃO DE OBRA: 02 ELET, 04 HH","date":"18/10/2025","rawDate":"2025-10-18T11:30:00.000Z","activityCode":"","asset":"CRAN-ELPC-261-PR-002","cause":"CORRECTIVE"},{"wo":"WO17143373","desc":"INSPECIONAR  MOTOR ELÉTRICO DE ELEVÇÃO DA PINÇA - CASO SEJA PRA TROCAR ABRIR ST COD ITEM: 800678163\tMOTOR ELETRICO 12/35CV 250S/M B5D DIREITO\n","date":"18/10/2025","rawDate":"2025-10-18T12:30:00.000Z","activityCode":"","asset":"CRAN-ELPC-261-PR-002","cause":"CORRECTIVE"},{"wo":"WO17824012","desc":"8316986 ST - SOLICITO QUE O MATERIAL RETORNE EM 19/09/2025. \nMATERIAL ENCONTRA-SE QUEIMADO.","date":"20/10/2025","rawDate":"2025-10-20T11:30:00.000Z","activityCode":"","asset":"CRAN-ELPC-261-PR-002","cause":"CORRECTIVE"},{"wo":"WO17869336","desc":"PREDITIVA - 24/OUT/2025 - CAÇO - SUBSTITUIR CABOS DE AÇO DO EQUIPAMENTO COM TAG CRAN-ELPC-261-PR-002_PINÇA OESTE, DEVIDO AO MESMO CONTER FIOS ROMPIDOS AO LONGO DO SEU COMPRIMENTO E PONTOS DE CORROSÕES.","date":"24/10/2025","rawDate":"2025-10-24T11:30:00.000Z","activityCode":"","asset":"CRAN-ELPC-261-PR-002","cause":"PREVENTIVE"},{"wo":"17781804","desc":"14D MANUT MEC PREV ELEV DA PINCA DAS PONTES ELETRD","date":"25/10/2025","rawDate":"2025-10-25T11:30:00.000Z","activityCode":"Y1ZCRAN-LU-ELPC-ELET03","asset":"CRAN-ELPC-261-PR-002","cause":"PREVENTIVE"},{"wo":"17781809","desc":"28D ELETRD MANUT MEC PREV DA SUCÇÃO COQUE - PONTES 261 E 262","date":"25/10/2025","rawDate":"2025-10-25T11:30:00.000Z","activityCode":"Y1ZCRAN-IN-ECL261-PR-141F23","asset":"CRAN-ELPC-261-PR-002","cause":"PREVENTIVE"},{"wo":"17794417","desc":"07D MANUT ELET INSP PREV PINCA LESTE E OESTE - PONTES 261 E 262 (REV23)","date":"25/10/2025","rawDate":"2025-10-25T11:30:00.000Z","activityCode":"Y1ZCRAN-IN-ECL261-PR-261001","asset":"CRAN-ELPC-261-PR-002","cause":"PREVENTIVE"},{"wo":"17794419","desc":"28D MANUT ELET PREV DO PANTÓGRAFO - PONTES 261 E 262","date":"25/10/2025","rawDate":"2025-10-25T11:30:00.000Z","activityCode":"Y1ZCRAN-IN-ECL261-PR-261007","asset":"CRAN-ELPC-261-PR-002","cause":"PREVENTIVE"},{"wo":"17847402","desc":"28D MANUT ELET PREV DO SISTEMA DE VACUO (SONDA) (REV23)","date":"25/10/2025","rawDate":"2025-10-25T11:30:00.000Z","activityCode":"Y1ZCRAN-IN-ECL261-PR-261008","asset":"CRAN-ELPC-261-PR-002","cause":"PREVENTIVE"},{"wo":"17847413","desc":"28D MANUT ELET PREV DOS COMPRESSORES (REV23)","date":"25/10/2025","rawDate":"2025-10-25T11:30:00.000Z","activityCode":"Y1ZCRAN-IN-ECL261-PR-261009","asset":"CRAN-ELPC-261-PR-002","cause":"PREVENTIVE"},{"wo":"WO17335901","desc":"SUBSTITUIR CABO DE ALIMENTACAO DO DISJUNTOR DA BOMBA DE VACUO, REQUISITAR TERMINAL 50 MM E TRILHO DINRECURSO MAO DE OBRA: 02 ELET, 03 HHMATERIAL:800143006 - TERMINAL OLHAL 50 MM (SOLICITAR 06 UNIDADES)801303619 - TRILHO DIN 35 MM (SOLI","date":"25/10/2025","rawDate":"2025-10-25T11:30:00.000Z","activityCode":"","asset":"CRAN-ELPC-261-PR-002","cause":"CORRECTIVE"},{"wo":"WO17335904","desc":"SUBSTITUIR FUSIVEIS DE 16A POR DISJUNTOR TERMOMAGNETICO TRIFASICO CURVA C DE 16 A DO PAINEL N2 DA ALIMENTACAO DO RESFRIADOR DE AR.RECURSO MAO DE OBRA: 02 ELET, 02 HHMATERIAL: 800561738  - DISJUNTOR TERMOMAGNETICO;TRIPOLAR;16A;500V 60HZ;1","date":"25/10/2025","rawDate":"2025-10-25T11:30:00.000Z","activityCode":"","asset":"CRAN-ELPC-261-PR-002","cause":"CORRECTIVE"},{"wo":"WO17882489","desc":"EMERG - FALSA INDICAÇAO DE CICLONE CHEIO","date":"26/10/2025","rawDate":"2025-10-26T08:35:00.000Z","activityCode":"","asset":"CRAN-ELPC-261-PR-002","cause":"CORRECTIVE"},{"wo":"WO17878150","desc":"07D 261-PONTES PREV MEC/ELE SEMANAL AR CONDICIONADO","date":"31/10/2025","rawDate":"2025-10-31T03:30:00.000Z","activityCode":"","asset":"CRAN-ELPC-261-PR-002","cause":"PREVENTIVE"},{"wo":"WO17766669","desc":"PREDITIVA - 23/SET/2025 - CAÇO - REALIZAR A TROCA DO SUPORTE E ROLDANA DO SUCCIONADOR DO EQUIPAMENTO ( CRAN-ELPC-261-PR-002) DEVIDO AO DESGASTE EXCESSIVO E TRINCAS NO SUPORTE.","date":"31/10/2025","rawDate":"2025-10-31T11:30:00.000Z","activityCode":"","asset":"CRAN-ELPC-261-PR-002","cause":"PREVENTIVE"},{"wo":"WO16800586","desc":"INSPECIONAR CHAVE REVERSORA KM43 KM44 SUBIDA E DESCIDA DO GUINCHO DE 5T.\n","date":"26/10/2025","rawDate":"2025-10-26T22:14:56.000Z","activityCode":"","asset":"CRAN-ELPC-261-PR-002","cause":"CORRECTIVE"},{"wo":"17794420","desc":"14D MANUT MEC PREV ELEV DA PINCA DAS PONTES ELETRD","date":"01/11/2025","rawDate":"2025-11-01T11:30:00.000Z","activityCode":"Y1ZCRAN-IN-ECL261-PR-141F22","asset":"CRAN-ELPC-261-PR-002","cause":"PREVENTIVE"},{"wo":"17794421","desc":"14D LUB DA ELEVACAO DA PINCA DE PONTE ROLANTE - 261 E 263","date":"01/11/2025","rawDate":"2025-11-01T11:30:00.000Z","activityCode":"Y1ZCRAN-IN-ECL261-PR-141F30","asset":"CRAN-ELPC-261-PR-002","cause":"PREVENTIVE"},{"wo":"17794422","desc":"14D MANUT MEC PREV DOS GUINCHOS DAS PONTES ELETRODOS","date":"01/11/2025","rawDate":"2025-11-01T11:30:00.000Z","activityCode":"Y1ZCRAN-IN-ECL261-PR-141F44","asset":"CRAN-ELPC-261-PR-002","cause":"PREVENTIVE"},{"wo":"17794424","desc":"28D LUBRIFICACAO DA TRANSLAÇÃO CARRO PINÇA - 261 E 262","date":"01/11/2025","rawDate":"2025-11-01T11:30:00.000Z","activityCode":"Y1ZCRAN-IN-ECL261-PR-141F95","asset":"CRAN-ELPC-261-PR-002","cause":"PREVENTIVE"},{"wo":"17807784","desc":"07D MANUT ELET INSP PREV PINCA LESTE E OESTE - PONTES 261 E 262 (REV23)","date":"01/11/2025","rawDate":"2025-11-01T11:30:00.000Z","activityCode":"Y1ZCRAN-IN-ECL261-PR-261001","asset":"CRAN-ELPC-261-PR-002","cause":"PREVENTIVE"},{"wo":"17807785","desc":"14D MANUT ELET PREV DA DESCARGA E SUCCIONADOR PONTES 261 E 262 (REV23)","date":"01/11/2025","rawDate":"2025-11-01T11:30:00.000Z","activityCode":"Y1ZCRAN-IN-ECL261-PR-261002","asset":"CRAN-ELPC-261-PR-002","cause":"PREVENTIVE"},{"wo":"17807786","desc":"28D MANUT ELET PREV TRANSLAÇÃO PONTE - PONTES 261 e 262 (REV23)","date":"01/11/2025","rawDate":"2025-11-01T11:30:00.000Z","activityCode":"Y1ZCRAN-IN-ECL261-PR-261003","asset":"CRAN-ELPC-261-PR-002","cause":"PREVENTIVE"},{"wo":"17807792","desc":"28D MANUT ELET MENSAL PREV DE MOTORES DAS PONTES 261 E 262","date":"01/11/2025","rawDate":"2025-11-01T11:30:00.000Z","activityCode":"Y1ZCRAN-IN-ECL261-PR-141F82","asset":"CRAN-ELPC-261-PR-002","cause":"PREVENTIVE"},{"wo":"WO17903117","desc":"EMERG - FALSA INDICACAO DE SILO DE COQUE CHEIO","date":"06/11/2025","rawDate":"2025-11-06T20:10:00.000Z","activityCode":"","asset":"CRAN-ELPC-261-PR-002","cause":"CORRECTIVE"},{"wo":"17819899","desc":"28D PPSC ELE INSP PREV TRANSLAÇÃO CARRO TREMONHA E TRANSLACAO PONTE - ECL","date":"08/11/2025","rawDate":"2025-11-08T03:00:00.000Z","activityCode":"Y1ZCRAN-IN-ECL261-PR-141F89","asset":"CRAN-ELPC-261-PR-002","cause":"PREVENTIVE"},{"wo":"17819910","desc":"07D MANUT ELET INSP PREV PINCA LESTE E OESTE - PONTES 261 E 262 (REV23)","date":"08/11/2025","rawDate":"2025-11-08T11:30:00.000Z","activityCode":"Y1ZCRAN-IN-ECL261-PR-261001","asset":"CRAN-ELPC-261-PR-002","cause":"PREVENTIVE"},{"wo":"WO17335907","desc":"REPROGRAMADO SUBSTITUIR CONTATORES DE FORCA KA 19, KA 21, KA 22, KA 23, KA 24 DO PAINEL DA BOMBA DE VACUO (REQUISITAR MATERIAL CAD 32)RECURSO MAO DE OBRA: 02 ELET, 02","date":"08/11/2025","rawDate":"2025-11-08T11:30:00.000Z","activityCode":"","asset":"CRAN-ELPC-261-PR-002","cause":"CORRECTIVE"},{"wo":"17807787","desc":"14D PPSC INSP PREV TESTE INICIAL - ELETRODOS","date":"02/11/2025","rawDate":"2025-11-02T23:55:59.000Z","activityCode":"Y1ZCRAN-IN-ECL261-PR-141F20","asset":"CRAN-ELPC-261-PR-002","cause":"PREVENTIVE"},{"wo":"17807789","desc":"28D ELETRD MANUT MEC PREV DA SUCÇÃO COQUE - PONTES 261 E 262","date":"08/11/2025","rawDate":"2025-11-08T11:30:00.000Z","activityCode":"Y1ZCRAN-IN-ECL261-PR-141F23","asset":"CRAN-ELPC-261-PR-002","cause":"PREVENTIVE"},{"wo":"17807790","desc":"28D MANUT MEC DA TRANSLACAO CARRO TREMONHA - PONTES 261 E 262","date":"08/11/2025","rawDate":"2025-11-08T11:30:00.000Z","activityCode":"Y1ZCRAN-IN-ECL261-PR-141F45","asset":"CRAN-ELPC-261-PR-002","cause":"PREVENTIVE"},{"wo":"17807791","desc":"28D MANUT MEC PREV DO COMPRESSOR - PONTES 261","date":"08/11/2025","rawDate":"2025-11-08T11:30:00.000Z","activityCode":"Y1ZCRAN-IN-ECL261-PR-141F80","asset":"CRAN-ELPC-261-PR-002","cause":"PREVENTIVE"},{"wo":"17807793","desc":"28D LUBRIFICACAO DA TRANSLAÇÃO CARRO TREMONHA - 261 E 262","date":"08/11/2025","rawDate":"2025-11-08T11:30:00.000Z","activityCode":"Y1ZCRAN-ELPC-261-PR-001-141F96","asset":"CRAN-ELPC-261-PR-002","cause":"PREVENTIVE"},{"wo":"17807794","desc":"84D LUBRIFICACAO DOS SISTEMAS DE PONTE ROLANTE - 261 E 262","date":"08/11/2025","rawDate":"2025-11-08T11:30:00.000Z","activityCode":"Y1ZCRAN-LU-ECL261-PR-LUBRI01","asset":"CRAN-ELPC-261-PR-002","cause":"PREVENTIVE"},{"wo":"WO17525670","desc":"REPROGRAMADO SUBSTITUIR CONTATORES CAD 32 KA 93, KA 94 , KA 95 , KA 96 , KA 97,  KA 98 , KA 99 , PAINEL N4.\n\n","date":"08/11/2025","rawDate":"2025-11-08T15:30:00.000Z","activityCode":"","asset":"CRAN-ELPC-261-PR-002","cause":"CORRECTIVE"},{"wo":"WO17910850","desc":"EMERG - PINCA NAO ABRE","date":"12/11/2025","rawDate":"2025-11-12T07:00:00.000Z","activityCode":"","asset":"CRAN-ELPC-261-PR-002","cause":"CORRECTIVE"},{"wo":"WO17913337","desc":"EMERG - PONTE NÃO TRANSLADA SENTIDO NORTE","date":"13/11/2025","rawDate":"2025-11-14T00:14:00.000Z","activityCode":"","asset":"CRAN-ELPC-261-PR-002","cause":"CORRECTIVE"},{"wo":"WO17839344","desc":"8334896 ST  - FAZER REPARO EM PONTE RETIDFICADORA - 261","date":"17/11/2025","rawDate":"2025-11-17T11:30:00.000Z","activityCode":"","asset":"CRAN-ELPC-261-PR-002","cause":"CORRECTIVE"},{"wo":"WO17921169","desc":"EMERG - FALSA INDICACAO DE SILO CHEIO","date":"19/11/2025","rawDate":"2025-11-19T17:19:59.999Z","activityCode":"","asset":"CRAN-ELPC-261-PR-002","cause":"CORRECTIVE"},{"wo":"WO17836060","desc":"REAPERTO DOS PARAFUSOS DA BOBINA DE FREIO PROXIMO AO SEM FIM DO REDUTOR TRANSLAÇÃO LADO LESTE\nMARIA - 98988089974","date":"22/11/2025","rawDate":"2025-11-22T16:47:59.999Z","activityCode":"","asset":"CRAN-ELPC-261-PR-002","cause":"CORRECTIVE"},{"wo":"WO17928282","desc":"EMERG - REAPERTAR ABRAÇADEIRA DA CASTANHA DO SUCCIONADOR","date":"25/11/2025","rawDate":"2025-11-25T03:34:59.999Z","activityCode":"","asset":"CRAN-ELPC-261-PR-002","cause":"CORRECTIVE"},{"wo":"WO17930385","desc":"EMERG - PINÇA LESTE NÃO ABRE","date":"27/11/2025","rawDate":"2025-11-27T05:19:59.999Z","activityCode":"","asset":"CRAN-ELPC-261-PR-002","cause":"CORRECTIVE"},{"wo":"WO17518804","desc":"SUBSTITUIR PARAFUSOS DE FIXAÇÃO DAS BRAÇADEIRAS DAS VEDAÇÕES DAS CASTANHAS.\n","date":"29/11/2025","rawDate":"2025-11-29T11:30:00.000Z","activityCode":"","asset":"CRAN-ELPC-261-PR-002","cause":"CORRECTIVE"},{"wo":"WO17638627","desc":"SUBSTITUIR PASTILHAS DE FREIO GUINCHO DE 20 TON DA 261-PR-002.\n\nRECURSO MÃO DE OBRA: 02 MEC, 03 HH\nMATERIAL: 800570842 - PASTILHAS DE FREIO GUINCHO 20 TON (SOLICITAR 02 PÇS)","date":"29/11/2025","rawDate":"2025-11-29T11:30:00.000Z","activityCode":"","asset":"CRAN-ELPC-261-PR-002","cause":"CORRECTIVE"},{"wo":"WO17895253","desc":"INSTALAR TOMADA 220V NA CABINE DA PONTE ROLANTE PARA USO DO CARREGADOR DO TABLET","date":"29/11/2025","rawDate":"2025-11-29T11:30:00.000Z","activityCode":"","asset":"CRAN-ELPC-261-PR-002","cause":"CORRECTIVE"},{"wo":"WO17495936","desc":"INSPECIONAR  REDUTOR INTERMEDIÁRIO CARRO TREMONHA 261-PR-002.\nCASO SEJA PRA TROCAR ABRIR ST COD 800519537","date":"29/11/2025","rawDate":"2025-11-29T11:30:00.000Z","activityCode":"","asset":"CRAN-ELPC-261-PR-002","cause":"CORRECTIVE"},{"wo":"WO17235089","desc":"SUBSTITUIR PARAFUSOS DA ESTRUTURA DE SUSTENTACAO DAS PINCAS 261-PR-002RECURSO MAO DE OBRA: 02 MEC 04 HHMATERIAL :803014526  - PARAFUSO|SEXTAVADO|M16 X 50  (SOLICITAR 50)803013267  - PORCA SEXTAVADA DE TORQUE DIÂMETRO: M16 (SOLICITAR 5","date":"29/11/2025","rawDate":"2025-11-29T11:30:00.000Z","activityCode":"","asset":"CRAN-ELPC-261-PR-002","cause":"CORRECTIVE"},{"wo":"17846832","desc":"14D MANUT MEC PREV ELEV DA PINCA DAS PONTES ELETRD","date":"29/11/2025","rawDate":"2025-11-29T11:30:00.000Z","activityCode":"Y1ZCRAN-LU-ELPC-ELET03","asset":"CRAN-ELPC-261-PR-002","cause":"PREVENTIVE"},{"wo":"17862396","desc":"07D MANUT ELET INSP PREV PINCA LESTE E OESTE - PONTES 261 E 262 (REV23)","date":"29/11/2025","rawDate":"2025-11-29T11:30:00.000Z","activityCode":"Y1ZCRAN-IN-ECL261-PR-261001","asset":"CRAN-ELPC-261-PR-002","cause":"PREVENTIVE"},{"wo":"17862397","desc":"28D MANUT ELET PREV TRANSLAÇÃO PONTE - PONTES 261 e 262 (REV23)","date":"29/11/2025","rawDate":"2025-11-29T11:30:00.000Z","activityCode":"Y1ZCRAN-IN-ECL261-PR-261003","asset":"CRAN-ELPC-261-PR-002","cause":"PREVENTIVE"},{"wo":"17862398","desc":"14D PPSC INSP PREV TESTE INICIAL - ELETRODOS","date":"29/11/2025","rawDate":"2025-11-29T11:30:00.000Z","activityCode":"Y1ZCRAN-IN-ECL261-PR-141F20","asset":"CRAN-ELPC-261-PR-002","cause":"PREVENTIVE"},{"wo":"17862404","desc":"28D MANUT ELET MENSAL PREV DE MOTORES DAS PONTES 261 E 262","date":"29/11/2025","rawDate":"2025-11-29T11:30:00.000Z","activityCode":"Y1ZCRAN-IN-ECL261-PR-141F82","asset":"CRAN-ELPC-261-PR-002","cause":"PREVENTIVE"},{"wo":"WO17820812","desc":"SUBSTITUIR REDUTOR","date":"18/11/2025","rawDate":"2025-11-18T10:58:44.000Z","activityCode":"","asset":"CRAN-ELPC-261-PR-002","cause":"CORRECTIVE"},{"wo":"WO17934414","desc":"PONTE SEM COMANDO DE TRANSLAÇAO","date":"01/12/2025","rawDate":"2025-12-01T04:25:00.000Z","activityCode":"","asset":"CRAN-ELPC-261-PR-002","cause":"CORRECTIVE"},{"wo":"WO17936792","desc":"PINCA COM INDICACAO FALSA DE SILO DE COQUE CHEIO","date":"01/12/2025","rawDate":"2025-12-01T06:49:59.999Z","activityCode":"","asset":"CRAN-ELPC-261-PR-002","cause":"CORRECTIVE"},{"wo":"WO17893160","desc":"EMERG - SUBSTITUIR AR CONDICIONADO","date":"30/10/2025","rawDate":"2025-10-30T21:30:00.000Z","activityCode":"","asset":"CRAN-ELPC-261-PR-002","cause":"CORRECTIVE"},{"wo":"WO17921799","desc":"Emergencia pinça leste desce","date":"20/11/2025","rawDate":"2025-11-20T19:47:59.999Z","activityCode":"","asset":"CRAN-ELPC-261-PR-002","cause":"CORRECTIVE"},{"wo":"WO17931114","desc":"Emergencia falsa indicação de silo de coque cheio","date":"27/11/2025","rawDate":"2025-11-27T21:30:00.000Z","activityCode":"","asset":"CRAN-ELPC-261-PR-002","cause":"CORRECTIVE"},{"wo":"WO17935702","desc":"SOLICITO A SUBSTITUIÇÃO DE 3 PINOS NA PINÇA LESTE 2 PINOS NA PINÇA OESTE","date":"01/12/2025","rawDate":"2025-12-01T03:00:00.000Z","activityCode":"","asset":"CRAN-ELPC-261-PR-002","cause":"CORRECTIVE"},{"wo":"WO17918271","desc":"EMERG - VALVULA FACA NAO ABRE","date":"17/11/2025","rawDate":"2025-11-17T04:09:59.999Z","activityCode":"","asset":"CRAN-ELPC-261-PR-002","cause":"CORRECTIVE"},{"type":"event","desc":"QUEDA DOS ANODOS","date":"30/11/2025, 00:00","rawDate":"2025-11-30T03:00:00.000Z","wo":"EVENT-793"}],"notes":{"annex_act_Y1ZCRAN-IN-ECL261-PR-261003":"{\"text\":\"\\\"Orientações:\\n1. Qualquer oportunidade detectada durante a execução desta WO deve ser registrada na\\n propria WO para analise \\\"\\\"pós trabalho\\\"\\\" do encarregado para identificar novas \\nanormalidades, sugestão de melhoria das técnicas e de gestão, e outros.\\n2. Tarefas preditivas que usem padrões de referencia devem ter seus valores registrados.\\n3. Obrigatório responder \\\"\\\"Encontrado problema?\\\"\\\". No caso de não haver uma resposta será \\nconsiderado como tarefa não realizada.\\n4. Caso seja encontrado problemas, é obrigatório a responder \\\"\\\"Ação?\\\"\\\". No caso de não\\nresposta, será considerado como falha de preenchimento e o encarregado deve reorientar.\\n5. Falhas prematuras decorrentes da má qualidade de execução ou falha no preenchimento \\nsão de responsabilidade do executante.\\n\\nATIVIDADE: 28D MANUT ELET PREV DA TRANSLAÇÃO PONTE - PONTES 261/262\\nProcedimento de Referência: LACDM \\nRevisada por:  Henrique Melo\\nData última revisão: 27/06/2025\\n\\n\\nSeq. Tarefa - Ponto - Detalhe                                       Detalhes da conclusão\\n\\n001 - Verificar da fixação da caixa de ligação dos motores - Translação Ponte - Com todos os box giratórios, bem vedado, cabos sem ferimentos e bem isolado (leste oeste/ dividir)\\nEncontrado problema? (   )S  (   )N   _______________________________________\\nAção? (   ) WO FOLLOW UP    (   ) CORREÇÃO    (  ) TROCA  ___________________\\n\\n002 - Medir Isolação do Motor - Translação Ponte Leste - Min 10 MOhms                                          \\nvalor medido (_____________________)\\nEncontrado problema? (   )S  (   )N   _________________________________________\\nAção? (   ) WO FOLLOW UP    (   ) CORREÇÃO    (  ) TROCA  _____________________\\n\\n003 - Medir Isolação do Motor - Translação Ponte Oeste - Min 10 MOhms                                  \\nvalor medido (_____________________)\\nEncontrado problema? (   )S  (   )N   _________________________________________\\nAção? (   ) WO FOLLOW UP    (   ) CORREÇÃO    (  ) TROCA  _____________________\\n\\n004 - Verificar das escovas do motor (fixação e desgaste)\\nEncontrado problema? (   )S  (   )N   _______________________________________\\nAção? (   ) WO FOLLOW UP    (   ) CORREÇÃO    (  ) TROCA  ___________________\\n                                                                               \\n005 - Verificar motor lado leste - TP – caixa de ligação om todos os box giratórios, bem vedado, cabos sem ferimentos e bem isolado\\nEncontrado problema? (   )S  (   )N   _______________________________________\\nAção? (   ) WO FOLLOW UP    (   ) CORREÇÃO    (  ) TROCA  ___________________\\n                                                                               \\n006 - Verificar cabos elétricos do motor leste - TP – sem ferimentos, isolamento sem ressecamento, fita isolante bem apertada\\nEncontrado problema? (   )S  (   )N   _______________________________________\\nAção? (   ) WO FOLLOW UP    (   ) CORREÇÃO    (  ) TROCA  ___________________\\n                                                                               \\n007 - Verificar motor lado oeste - TP - Com todos os box giratórios, bem vedado, cabos sem ferimentos e bem isolado\\nEncontrado problema? (   )S  (   )N   _______________________________________\\nAção? (   ) WO FOLLOW UP    (   ) CORREÇÃO    (  ) TROCA  ___________________\\n\\n008 - Verificar cabos elétricos do motor oeste - TP - sem ferimentos, isolamento sem ressecamento, fita isolante bem apertada\\nEncontrado problema? (   )S  (   )N   _______________________________________\\nAção? (   ) WO FOLLOW UP    (   ) CORREÇÃO    (  ) TROCA  ___________________\\n                                                                               \\n009 – Caso aplicável, verificar Cabo aterramento Norte/leste - estrutura truck - sem folga bem apertado\\nEncontrado problema? (   )S  (   )N   _______________________________________\\nAção? (   ) WO FOLLOW UP    (   ) CORREÇÃO    (  ) TROCA  ___________________\\n\\\"\\n\",\"periodicity\":\"\",\"resource\":\"\",\"hh\":\"\"}","annex_act_Y1ZCRAN-IN-ECL261-PR-141F90":"{\"text\":\"\\\"Orientacoes:\\n1. Qualquer oportunidade detectada durante a execução desta WO deve ser registrada na\\n propria WO para analise do encarregado -  análise pós trabalho (novas \\nanormalidades, sugestão de melhoria técnicas e de gestão)\\n2. Atividades executadas devem ter seus status avaliados como \\\"\\\"OK\\\"\\\", atividades não\\n executadas devem ter seus status registrados como \\\"\\\"NOK\\\"\\\" e encaminhadas para análise \\ndo encarregado (cancelar ou reprogramar). Atividades que usem um padrão de referencia \\ndevem ter seus valores registrados no campo valor.\\n3. Falhas prematuras decorrentes da má qualidade de execução ou falha nos registros é \\nde responsabilidade do executante.\\n\\nAtividade:                  28D PPSC ELE INSP PREV FERRAMENTA GUINCHO - ELETRODOS\\nProcedimento de Referencia: BPAP:\\nRevisada por:               Giovanni Lima, Celio Raposo, Ciro Camelo, Hilton França, \\n                            Ernesto Franklin, Lana Martins e Hugo Farias em 28/02/2011\\nLEGENDA STATUS:  \\nOK: Atividade realizada\\nNOK:  Atividade NAO realizada\\nSP: Sem problema - equipamento OK\\n\\nSeq. Tarefa - Ponto - Detalhe                                       Detalhes da conclusão\\n001 - Inspecionar motor elevação  - Guincho 20t - Integridade \\n                                                    [(OK)  (NOK)] [(SP)] Valor___________\\n002 - Inspecionar limite de cames - Guincho 20t - Integridade \\n                                                    [(OK)  (NOK)] [(SP)] Valor___________\\n003 - Inspecionar limite superior - Guincho de 20t - Integridade\\n                                                    [(OK)  (NOK)] [(SP)] Valor___________\\n004 - Inspecionar limite inferior - Guincho de 20t - Integridade\\n                                                    [(OK)  (NOK)] [(SP)] Valor___________\\n005 - Inspecionar freio - Guincho de 20t - Integridade\\n                                                    [(OK)  (NOK)] [(SP)] Valor___________\\\"\\n\",\"periodicity\":\"\",\"resource\":\"\",\"hh\":\"\"}","annex_act_Y1ZCRAN-IN-ECL261-PR-141F82":"{\"text\":\"\\\"Orientacoes:\\n1. Qualquer oportunidade detectada durante a execução desta WO deve ser registrada na\\n propria WO para analise do encarregado - deve ter análise pós trabalho (novas \\nanormalidades, sugestão de melhoria técnicas e de gestão)\\n2. Atividades executadas devem ter seus status avaliados como \\\"\\\"OK\\\"\\\", atividades não\\n executadas devem ter seus status registrados como \\\"\\\"NOK\\\"\\\" e encaminhadas para análise \\ndo encarregado (cancelar ou reprogramar). Atividades que usem um padrão de referencia \\ndevem ter seus valores registrados no campo valor.\\n3. Falhas prematuras decorrentes da má qualidade de execução ou falha nos registros é \\nde responsabilidade do executante.\\n\\nAtividade:                  14D PPSC ELE INSP PRED ISOLAÇÃO GERAL ELETRODOS \\nProcedimento de Referencia: BPAP:\\nRevisada por:               Giovanni Lima, Celio Raposo, Ciro Camelo, Roberto Marques, \\n                            Lana Martins e Hugo Farias em 23/07/2010\\nLEGENDA STATUS:  \\nOK: Atividade realizada\\nNOK:  Atividade NAO realizada\\nSP: Sem problema - equipamento OK\\n\\nSeq. Tarefa - Ponto - Detalhe                                       Detalhes da conclusão\\n001 - Megar Motor - Transl. Ponte Leste - Min 10Mohms\\n                                                    [(OK)  (NOK)] [(SP)] Valor___________\\n002 - Megar Motor - Transl. Ponte Oeste - Min 10Mohms\\n                                                    [(OK)  (NOK)] [(SP)] Valor___________\\n003 - Megar Motor - Transl. Carro - Min 10Mohms\\n                                                    [(OK)  (NOK)] [(SP)] Valor___________\\n004 - Megar Motor - Elevação Guincho 20t - Min 10Mohms\\n                                                    [(OK)  (NOK)] [(SP)] Valor___________\\n005 - Megar Motor - Transl. Guincho 20t - Min 10Mohms\\n                                                    [(OK)  (NOK)] [(SP)] Valor___________\\n006 - Megar Motor - Elevação Guincho 5t - Min 10Mohms\\n                                                    [(OK)  (NOK)] [(SP)] Valor___________\\n007 - Megar Motor - Transl. Guincho 5t - Min 10Mohms\\n                                                    [(OK)  (NOK)] [(SP)] Valor___________\\n008 - Megar Isolação do Motor Giro da Cab. - cabine - min 10Mohms\\n                                                    [(OK)  (NOK)] [(SP)] Valor___________\\\"\\n\",\"periodicity\":\"\",\"resource\":\"\",\"hh\":\"\"}","annex_act_Y1ZCRAN-IN-ECL261-PR-141F23":"{\"text\":\"\\\"ORIENTACOES:\\n1. QUALQUER OPORTUNIDADE DETECTADA DURANTE A EXECUCAO DESTA WO DEVE SER REGISTRADA NA PROPRIA WO, REGISTRADA E DETALHADA NESTE ANEXO PARA ANALISE DO ENCARREGADO DEVE TER ANALISE POS TRABALHO (NOVAS ANORMALIDADES, SUGESTAO DE MELHORIAS TECNICAS E DE GESTAO)\\n2. ATIVIDADES EXECUTADAS DEVEM TER SEUS STATUS AVALIADOS COMO \\\"\\\"OK\\\"\\\", ATIVIDADES NÃO  EXECUTADAS DEVEM TER SEUS STATUS REGISTRADOS COMO \\\"\\\"NOK\\\"\\\" E ENCAMINHADAS PARA ANÁLISE DO ENCARREGADO (REPROGRAMAR). ATIVIDADES QUE USEM UM PADRÃO DE REFERENCIA DEVEM TER SEUS VALORES REGISTRADOS NO CAMPO VALOR.\\n3. FALHAS PREMATURAS DECORRENTES DA MA QUALIDADE DE EXECUÇÃO OU FALHA NOS REGISTROS SERAO DE RESPONSABILIDADE DO EXECUTANTE.\\n4. NAO CONFORMIDADE PROGRAMAR DENTRO DE 3 SEMANAS - CORRIGIR DE IMEDIATO SE HOUVER PROBABILIDADE DE FALHA ANTES DESSE PERIODO\\n\\nATIVIDADE: 28D ELETRD MANUT MEC PREV DA SUCÇÃO COQUE - PONTES 261 E 262\\n           Y1ZCRAN-IN-ECL261-PR-141F23\\n\\nDURACAO[H]: 4H\\nRECURSO: 2 MEC\\n                \\nPROCEDIMENTOS DE REFERENCIA:\\n\\nULTIMA REVISAO: NOVEMBRO, 2024\\nREVISORES: ANDRÉ LACERDA, KLEYTON SANTOS\\n\\n-------------------------------------------------------\\nSEQ. - TAREFA - PONTO - DETALHE - DETALHES DA CONCLUSAO\\n\\n***\\nEXPRESSAMENTE PROIBIDO A LIBERACAO DA PONTE SEM QUE SE REALIZE AS TROCAS DOS ITENS PARA OS QUAIS SE SOLICITA A TROCA !\\n***\\n\\n001 - INSPECIONAR CORREIA - BOMBA DE VÁCUO - VERIFICAR SE FALTA ALGUMA, SEM FOLGAS OU TRINCAS, TENSIONSAMENTO CORRETO\\nREALIZADO POR COMPLETO? (  )OK (  )NOK\\nENCONTRADO PROBLEMA?    (  )S  (  )N   CORRIGIDO? (  )S(  )N RELATAR:_________________________________\\n\\n002 - VERIFICAR NÍVEL DE ÓLEO - BOMBA DE VÁCUO - NÍVEL DE ÓLEO VISÍVEL NO VISOR\\nREALIZADO POR COMPLETO? (  )OK (  )NOK\\nENCONTRADO PROBLEMA?    (  )S  (  )N   CORRIGIDO? (  )S(  )N RELATAR:_________________________________\\n\\n003 - CONTROLE DE ESTANQUEIDADE - BOMBA DE VÁCUO - NENHUM VAZAMENTO IDENTIFICADO\\nREALIZADO POR COMPLETO? (  )OK (  )NOK\\nENCONTRADO PROBLEMA?    (  )S  (  )N   CORRIGIDO? (  )S(  )N RELATAR:_________________________________\\n\\n004 - VERIFICAR APERTO DOS PARAFUSOS DE FIXAÇÃO DA BASE - BOMBA DE VÁCUO - PARAFUSOS DEVIDAMENTE FIXADOS\\nREALIZADO POR COMPLETO? (  )OK (  )NOK\\nENCONTRADO PROBLEMA?    (  )S  (  )N   CORRIGIDO? (  )S(  )N RELATAR:_________________________________\\n\\n005 - INSPECIONAR SILENCIADOR DE ENTRADA DE AR - BOMBA DE VÁCUO - CHECAR SE NÃO HÁ POEIRA NO SILENCIADOR\\n      CASO HAJA POEIRA, VERIFICAR SE FILTRO DE SEGURANÇA ESTÁ DANIFICADO\\nREALIZADO POR COMPLETO? (  )OK (  )NOK\\nENCONTRADO PROBLEMA?    (  )S  (  )N   CORRIGIDO? (  )S(  )N RELATAR:_________________________________\\n\\n006 - INSPECIONAR ESTRUTURA - BOMBA DE VÁCUO - DESGASTES E RUÍDO EXCESSIVO: PROGRAMAR TROCA E ENVIAR PARA REPARO \\nREALIZADO POR COMPLETO? (  )OK (  )NOK\\nENCONTRADO PROBLEMA?    (  )S  (  )N   CORRIGIDO? (  )S(  )N RELATAR:_________________________________\\n\\n007 - CONTROLE DE ESTANQUEIDADE E LIMPEZA - FILTRO DE SEGURANÇA DA BOMBA (TAMPA E TUBOS) - LIMPAR USANDO JATEAMENTO DE AR COMPRIMIDO\\nREALIZADO POR COMPLETO? (  )OK (  )NOK\\nENCONTRADO PROBLEMA?    (  )S  (  )N   CORRIGIDO? (  )S(  )N RELATAR:_________________________________\\n\\n008 - INSPECIONAR - VÁLVULAS DE SEGURANÇA - VÁLVULAS NÃO ESTÃO OBSTRUÍDAS POR POEIRA - CHECAR PRESSIONANDO A PARTE INFERIOR DA VÁLVULA\\n      CASO ESTEJA TRAVADA, DESMONTE, LIMPE E PREENCHA O RESERVATÓRIO DE ÓLEO DO TUBO AMORTECEDOR\\nREALIZADO POR COMPLETO? (  )OK (  )NOK\\nENCONTRADO PROBLEMA?    (  )S  (  )N   CORRIGIDO? (  )S(  )N RELATAR:_________________________________\\n\\n009 - INSPECIONAR - POLIA MOVIDA - SEM EMPENO E ALINHADA À MOTRIZ\\nREALIZADO POR COMPLETO? (  )OK (  )NOK\\nENCONTRADO PROBLEMA?    (  )S  (  )N   CORRIGIDO? (  )S(  )N RELATAR:_________________________________\\n\\n010 - INSPECIONAR - POLIA MOTRIZ - SEM EMPENO E ALINHADA À MOVIDA\\nREALIZADO POR COMPLETO? (  )OK (  )NOK\\nENCONTRADO PROBLEMA?    (  )S  (  )N   CORRIGIDO? (  )S(  )N RELATAR:_________________________________\\n\\n011 - INSPECIONAR - PROTEÇÃO DE MÁQUINA DO ACIONAMENTO - PRESENTE E EM CONFORMIDADE COM A NORMA\\nREALIZADO POR COMPLETO? (  )OK (  )NOK\\nENCONTRADO PROBLEMA?    (  )S  (  )N   CORRIGIDO? (  )S(  )N RELATAR:_________________________________\\n\\n012 - VERIFICAR NÍVEL DE ÓLEO - REDUTOR DE ELEVAÇÃO DO SUCCIONADOR - REPOR SE NÃO ESTIVER VISÍVEL NO VISOR\\nREALIZADO POR COMPLETO? (  )OK (  )NOK\\nENCONTRADO PROBLEMA?    (  )S  (  )N   CORRIGIDO? (  )S(  )N RELATAR:_________________________________\\n\\n013 - INSPECIONAR RETENTOR - REDUTOR DE ELEVAÇÃO DO SUCCIONADOR - SUBSTITUIR REDUTOR SE NECESSÁRIO\\nREALIZADO POR COMPLETO? (  )OK (  )NOK\\nENCONTRADO PROBLEMA?    (  )S  (  )N   CORRIGIDO? (  )S(  )N RELATAR:_________________________________\\n\\n014 - INSPECIONAR CURVAS DE SUCÇÃO - TUBULAÇÃO DE SUCÇÃO DA BOMBA - SEM EMPENO E VAZAMENTO\\nREALIZADO POR COMPLETO? (  )OK (  )NOK\\nENCONTRADO PROBLEMA?    (  )S  (  )N   CORRIGIDO? (  )S(  )N RELATAR:_________________________________\\n\\n015 - INSPECIONAR ROLDANA - TUBO FIXO - SEM FOLGA\\nREALIZADO POR COMPLETO? (  )OK (  )NOK\\nENCONTRADO PROBLEMA?    (  )S  (  )N   CORRIGIDO? (  )S(  )N RELATAR:_________________________________\\n\\n016 - INSPECIONAR - TUBO FIXO - SEM FOLGA, CORROSÃO OU FUROS NA TUBULAÇÃO\\nREALIZADO POR COMPLETO? (  )OK (  )NOK\\nENCONTRADO PROBLEMA?    (  )S  (  )N   CORRIGIDO? (  )S(  )N RELATAR:_________________________________\\n\\n017 - INSPECIONAR - TUBO TELESCOPICO - SEM FOLGA, CORROSÃO OU FUROS NA TUBULAÇÃO - REPARAR SE NECESSÁRIO\\nREALIZADO POR COMPLETO? (  )OK (  )NOK\\nENCONTRADO PROBLEMA?    (  )S  (  )N   CORRIGIDO? (  )S(  )N RELATAR:_________________________________\\n\\n018 - INSPECIONAR SUSPENSÃO - PARTE INFERIOR DO TUBO FIXO - SEM EMPENO\\nREALIZADO POR COMPLETO? (  )OK (  )NOK\\nENCONTRADO PROBLEMA?    (  )S  (  )N   CORRIGIDO? (  )S(  )N RELATAR:_________________________________\\n\\n019 - INSPECIONAR CABO DE AÇO - PARTE INFERIOR DO TUBO FIXO - SEM DEFORMAÇÃO - SUBSTITUIR SE NECESSÁRIO\\nREALIZADO POR COMPLETO? (  )OK (  )NOK\\nENCONTRADO PROBLEMA?    (  )S  (  )N   CORRIGIDO? (  )S(  )N RELATAR:_________________________________\\n\\n020 - INSPECIONAR JUNTA FLEXÍVEL - PARTE SUPERIOR DO TUBO FIXO - SEM DEFORMAÇÃO E DESGASTE - SUBSTITUIR SE NECESSÁRIO\\nREALIZADO POR COMPLETO? (  )OK (  )NOK\\nENCONTRADO PROBLEMA?    (  )S  (  )N   CORRIGIDO? (  )S(  )N RELATAR:_________________________________\\n\\n\\n-------------------------------------------------------\\\"\\n\",\"periodicity\":\"\",\"resource\":\"\",\"hh\":\"\"}","annex_act_Y1ZCRAN-IN-ECL261-PR-261002":"{\"text\":\"\\\"Y1ZCRAN-IN-ECL261-PR-261002\\n\\nTEXTO\\nOrientações:\\n1. Qualquer oportunidade detectada durante a execução desta WO deve ser registrada na\\n propria WO para analise \\\"\\\"pós trabalho\\\"\\\" do encarregado para identificar novas \\nanormalidades, sugestão de melhoria das técnicas e de gestão, e outros.\\n2. Tarefas preditivas que usem padrões de referencia devem ter seus valores registrados.\\n3. Obrigatório responder \\\"\\\"Encontrado problema?\\\"\\\". No caso de não haver uma resposta será \\nconsiderado como tarefa não realizada.\\n4. Caso seja encontrado problemas, é obrigatório a responder \\\"\\\"Ação?\\\"\\\". No caso de não\\nresposta, será considerado como falha de preenchimento e o encarregado deve reorientar.\\n5. Falhas prematuras decorrentes da má qualidade de execução ou falha no preenchimento \\nsão de responsabilidade do executante.\\n\\nATIVIDADE: 14D MANUT ELET PREV DA DESCARGA E SUCCIONADOR PONTES 261 E 262 (REV23)\\nProcedimento de Referência: LACDM \\nRevisada por:  Suzy Amaral, Aysla Oliveira, Jairon Martins.\\nData última revisão: 10/01/2023\\n\\n\\nSeq. Tarefa - Ponto - Detalhe                                       Detalhes da conclusão\\n\\n001 - Inspecionar limite cabo frouxo - Succionador - Funcionando\\nEncontrado problema? (   )S  (   )N   _______________________________________\\nAção? (   ) WO FOLLOW UP    (   ) CORREÇÃO    (  ) TROCA  ___________________\\n                                                                                \\n002 - Inspecionar limite cabo tensionado - Succionador - Funcionando\\nEncontrado problema? (   )S  (   )N   _______________________________________\\nAção? (   ) WO FOLLOW UP    (   ) CORREÇÃO    (  ) TROCA  ___________________\\n                                                                                \\n003 - Inspecionar limite de cames  - Succionador - Funcionando\\nEncontrado problema? (   )S  (   )N   _______________________________________\\nAção? (   ) WO FOLLOW UP    (   ) CORREÇÃO    (  ) TROCA  ___________________\\n                                                                               \\n004 - Inspecionar limite cabo frouxo - Descarga - Funcionando\\nEncontrado problema? (   )S  (   )N   _______________________________________\\nAção? (   ) WO FOLLOW UP    (   ) CORREÇÃO    (  ) TROCA  ___________________\\n\\n005 - Inspecionar limite cabo tensionado - Descarga - Funcionando\\nEncontrado problema? (   )S  (   )N   _______________________________________\\nAção? (   ) WO FOLLOW UP    (   ) CORREÇÃO    (  ) TROCA  ___________________\\n                                                                           \\n006 - Inspecionar limite de cames  - Descarga - Funcionando\\nEncontrado problema? (   )S  (   )N   _______________________________________\\nAção? (   ) WO FOLLOW UP    (   ) CORREÇÃO    (  ) TROCA  ___________________\\n\\\"\\n\",\"periodicity\":\"\",\"resource\":\"\",\"hh\":\"\"}","annex_act_Y1ZCRAN-IN-ECL261-PR-141F47":"{\"text\":\"\\\"Orientações:\\n1. Qualquer oportunidade detectada durante a execução desta WO deve ser registrada na\\n propria WO para analise do encarregado - deve ter análise pós trabalho (novas \\nanormalidades, sugestão de melhoria técnicas e de gestão)\\n2. Atividades executadas devem ter seus status avaliados como \\\"\\\"OK\\\"\\\", atividades não\\n executadas devem ter seus status registrados como \\\"\\\"NOK\\\"\\\" e encaminhadas para análise \\ndo encarregado (cancelar ou reprogramar). Atividades que usem um padrão de referencia \\ndevem ter seus valores registrados no campo valor.\\n3. Falhas prematuras decorrentes da má qualidade de execução ou falha nos registros é \\nde responsabilidade do executante.\\n\\nAtividade:                  28D PPSC MEC INSP PREV DESCARGA COQUE\\nProcedimento de Referencia: BPAP:\\nRevisada por:               Giovanni Lima, Celio Raposo, Ciro Camelo, Roberto Marques, \\n                            Lana Martins e Hugo Farias em 23/07/2010\\nLEGENDA STATUS:  \\nOK: Atividade realizada\\nNOK:  Atividade NAO realizada\\nSP: Sem problema - equipamento OK\\n\\nSeq. Tarefa - Ponto - Detalhe                                       Detalhes da conclusão\\n001 - Insp. Integridade - junta de expansão - sem trincas\\n                                                           [(OK)  (NOK)] Valor___________\\n002 - Insp. Integridade - munhões - integridade\\n                                                           [(OK)  (NOK)] Valor___________\\n003 - Insp. Integridade - molas de suspensão - integridade\\n                                                           [(OK)  (NOK)] Valor___________\\n004 - Medir desgaste - pastilha de freio - máximo 5mm\\n                                                           [(OK)  (NOK)] Valor___________\\n005 - Medir desgaste - disco de freio - máximo 5mm\\n                                                           [(OK)  (NOK)] Valor___________\\\"\\n\",\"periodicity\":\"\",\"resource\":\"\",\"hh\":\"\"}","annex_act_Y1ZCRAN-IN-ECL261-PR-141F30":"{\"text\":\"SEM ANEXO\",\"periodicity\":\"\",\"resource\":\"\",\"hh\":\"\"}","annex_act_Y1ZCRAN-IN-ECL261-PR-141F22":"{\"text\":\"\\\"Orientações:\\n1. Qualquer oportunidade detectada durante a execução desta WO deve ser registrada na\\n propria WO para analise \\\"\\\"pós trabalho\\\"\\\" do encarregado para identificar novas \\nanormalidades, sugestão de melhoria das técnicas e de gestão, e outros.\\n2. Tarefas preditivas que usem padrões de referencia devem ter seus valores registrados.\\n3. Obrigatório responder \\\"\\\"Encontrado problema?\\\"\\\". No caso de não haver uma resposta será \\nconsiderado como tarefa não realizada.\\n4. Caso seja encontrado problemas, é obrigatório a responder \\\"\\\"Corrigido?\\\"\\\". No caso de não\\nresposta, será considerado como falha de preenchimento e o encarregado deve reorientar.\\n5. Falhas prematuras decorrentes da má qualidade de execução ou falha no preenchimento \\nsão de responsabilidade do executante.\\n\\nAtividade: 7D PPSC MEC INSP PREV FERRAMENTA PINÇA - ELETRODOS\\nProcedimento de Referencia: BPAP\\nRevisada por: Celio Raposo, Ciro Camelo, Lana Martins, Ernesto Franklin            \\nData ultima revisão: 28/02/2011\\n\\nSeq. Tarefa - Ponto - Detalhe                                      Detalhes da conclusão\\n001 - Insp. Pinos da pinça oeste - pinça oeste - sem desgaste\\nEncontrado problema? ( )S( )N   Corrigido? ( )S( )N        \\n002 - Insp. Pinos da pinça leste - pinça leste - sem desgaste\\nEncontrado problema? ( )S( )N   Corrigido? ( )S( )N       \\n003 - insp. Parafusos de Fixação - Tubo Movel - sem folga\\nEncontrado problema? ( )S( )N   Corrigido? ( )S( )N        \\n004 - insp. Chapa trava - torpedo da pinça - sem folga\\nEncontrado problema? ( )S( )N   Corrigido? ( )S( )N        \\n005 - insp. Rolo guia - Pinça - integridade\\nEncontrado problema? ( )S( )N   Corrigido? ( )S( )N        \\n006 - insp. Placa de desgaste - torpedo - integridade \\nEncontrado problema? ( )S( )N   Corrigido? ( )S( )N        \\n007 - insp. Polias - pinça - destravados \\nEncontrado problema? ( )S( )N   Corrigido? ( )S( )N        \\n008 - insp. Cabo de aço - integridade e fixação\\nEncontrado problema? ( )S( )N   Corrigido? ( )S( )N        \\n009 - insp. Redutor abertura pinça - pinça oeste - sem folga\\nEncontrado problema? ( )S( )N   Corrigido? ( )S( )N        \\n010 - insp. Redutor abertura pinça - pinça leste - sem folga\\nEncontrado problema? ( )S( )N   Corrigido? ( )S( )N        \\n011 - insp. Rolos guia do trilho elevação - pinça - sem folga\\nEncontrado problema? ( )S( )N   Corrigido? ( )S( )N        \\n012 - insp. Parafusos da coluna - pinça - sem folga\\nEncontrado problema? ( )S( )N   Corrigido? ( )S( )N        \\n013 - insp. Roda guia - pinça - destravados\\nEncontrado problema? ( )S( )N   Corrigido? ( )S( )N        \\n014 - insp. Roda motriz - pinça - sem trincas\\nEncontrado problema? ( )S( )N   Corrigido? ( )S( )N        \\n015 - insp. Roda motora - pinça - sem trincas\\nEncontrado problema? ( )S( )N   Corrigido? ( )S( )N        \\n016 - insp. Batedor lateral - pinça - fixação sem folga\\nEncontrado problema? ( )S( )N   Corrigido? ( )S( )N        \\n017 - insp. Pastilha - freio translação pinça - sem desgaste excessivo\\nEncontrado problema? ( )S( )N   Corrigido? ( )S( )N        \\n018 - insp. Elemento elástico - translação pinça - sem avarias \\nEncontrado problema? ( )S( )N   Corrigido? ( )S( )N        \\n019 - insp. Redutor de elevação pinça - pinça leste - sem folga\\nEncontrado problema? ( )S( )N   Corrigido? ( )S( )N        \\n020 - insp. Redutor de elevação pinça - pinça oeste - sem folga\\nEncontrado problema? ( )S( )N   Corrigido? ( )S( )N        \\n021 - insp. Elemento elastico redutor de elevação - pinça leste - sem folga\\nEncontrado problema? ( )S( )N   Corrigido? ( )S( )N        \\n022 - insp. Elemento elastico redutor de elevação - pinça Oeste - sem folga\\nEncontrado problema? ( )S( )N   Corrigido? ( )S( )N        \\n023 - insp. Pastilha de freio elevação - pinça leste - sem avarias \\nEncontrado problema? ( )S( )N   Corrigido? ( )S( )N        \\n024 - insp. Pastilha de freio elevação - pinça oeste - sem avarias \\nEncontrado problema? ( )S( )N   Corrigido? ( )S( )N        \\n025 - insp. Nivel de óleo redutor de elevação - Pinça oeste - padrão pelo visor\\nEncontrado problema? ( )S( )N   Corrigido? ( )S( )N        \\n026 - insp. Nivel de óleo redutor de elevação - Pinça leste - padrão pelo visor\\nEncontrado problema? ( )S( )N   Corrigido? ( )S( )N        \\n027 - insp. Roldanas do dromo - dromo - sem folga e destravada\\nEncontrado problema? ( )S( )N   Corrigido? ( )S( )N        \\n028 - insp. Elemento elástico redutor de abertura - sem avarias\\nEncontrado problema? ( )S( )N   Corrigido? ( )S( )N        \\n029 - testar sistema de freio de elevação - pinça leste - perfeito funcionamento\\nEncontrado problema? ( )S( )N   Corrigido? ( )S( )N        \\n030 - testar sistema de freio de elevação - pinça oeste - perfeito funcionamento\\nEncontrado problema? ( )S( )N   Corrigido? ( )S( )N        \\n031 - insp. Alinhamento da pinça - pinça leste - alinhado\\nEncontrado problema? ( )S( )N   Corrigido? ( )S( )N        \\n032 - insp. Alinhamento da pinça - pinça oeste - alinhado\\nEncontrado problema? ( )S( )N   Corrigido? ( )S( )N        \\n\\\"\\n\",\"periodicity\":\"\",\"resource\":\"\",\"hh\":\"\"}","annex_act_Y1ZCRAN-IN-ECL261-PR-141F81":"{\"text\":\"\\\"Orientações:\\n1. Qualquer oportunidade detectada durante a execução desta WO deve ser registrada na\\n propria WO para analise do encarregado - deve ter análise pós trabalho (novas \\nanormalidades, sugestão de melhoria técnicas e de gestão)\\n2. Atividades executadas devem ter seus status avaliados como \\\"\\\"OK\\\"\\\", atividades não\\n executadas devem ter seus status registrados como \\\"\\\"NOK\\\"\\\" e encaminhadas para análise \\ndo encarregado (cancelar ou reprogramar). Atividades que usem um padrão de referencia \\ndevem ter seus valores registrados no campo valor.\\n3. Falhas prematuras decorrentes da má qualidade de execução ou falha nos registros é \\nde responsabilidade do executante.\\n\\nAtividade:                  28D PPSC ELE INSP PREV PANTÓGRAFO \\nProcedimento de Referencia: BPAP:\\nRevisada por:               Giovanni Lima, Celio Raposo, Ciro Camelo, Roberto Marques, \\n                            Lana Martins e Hugo Farias em 23/07/2010\\nLEGENDA STATUS:  \\nOK: Atividade realizada\\nNOK:  Atividade NAO realizada\\nSP: Sem problema - equipamento OK\\n\\nSeq. Tarefa - Ponto - Detalhe                                       Detalhes da conclusão\\n001 - Desligar barramento - barramento - padrão desligado\\n                                                    [(OK)  (NOK)] [(SP)] Valor___________\\n002 - Insp. Pantógrafos - pantógrafos - padão integro\\n                                                    [(OK)  (NOK)] [(SP)] Valor___________\\n003 - Insp. Conexões elétricas - conexões - sem folgas\\n                                                    [(OK)  (NOK)] [(SP)] Valor___________\\n004 - Insp. Molas das escovas - pantógrafos - sem desgaste\\n                                                    [(OK)  (NOK)] [(SP)] Valor___________\\n005 - Insp. Escovas - pantografos - sem desgaste\\n                                                    [(OK)  (NOK)] [(SP)] Valor___________\\n006 - Insp. Cabos elétricos - pantógrafos - integros \\n                                                    [(OK)  (NOK)] [(SP)] Valor___________\\n\\\"\\n\",\"periodicity\":\"\",\"resource\":\"\",\"hh\":\"\"}","annex_act_Y1ZCRAN-IN-ECL261-PR-141F97":"{\"text\":\"\\\"Orientações:\\n1. Qualquer oportunidade detectada durante a execução desta WO deve ser registrada na\\n propria WO para analise \\\"\\\"pós trabalho\\\"\\\" do encarregado para identificar novas \\nanormalidades, sugestão de melhoria das técnicas e de gestão, e outros.\\n2. Tarefas preditivas que usem padrões de referencia devem ter seus valores registrados.\\n3. Obrigatório responder \\\"\\\"Encontrado problema?\\\"\\\". No caso de não haver uma resposta será \\nconsiderado como tarefa não realizada.\\n4. Caso seja encontrado problemas, é obrigatório a responder \\\"\\\"Corrigido?\\\"\\\". No caso de não\\nresposta, será considerado como falha de preenchimento e o encarregado deve reorientar.\\n5. Falhas prematuras decorrentes da má qualidade de execução ou falha no preenchimento \\nsão de responsabilidade do executante.\\n\\nAtividade: 84D PPSC MEC LUB FERRAMENTA GUINCHO - ELETRODOS\\nProcedimento de Referencia: BPAP\\nRevisada por: Celio Raposo, Ciro Camelo, Lana Martins, Hugo Farias, Luiz Eduardo\\nData ultima revisão: 26/05/2011\\n\\nSeq. Tarefa - Ponto - Detalhe                                       Detalhes da conclusão\\n001 - Lubrificar Redutor 2 ponto - guincho prin. - Omala 320 669ml\\nEncontrado problema? ( )S( )N   Corrigido? ( )S( )N      \\n\\n002 - Lubrificar Acoplamentos 3 unidades - guincho prin. - Alvania EP-LF2 790ml\\nEncontrado problema? ( )S( )N   Corrigido? ( )S( )N      \\n\\n003 - Lubrificar Mancal do Dromo - guincho prin. - Alvania EP-LF2 790ml\\nEncontrado problema? ( )S( )N   Corrigido? ( )S( )N      \\n\\n004 - Lubrificar Caixa de Roldanas 3 pontos - guincho prin. - Alvania EP-LF2 790ml\\nEncontrado problema? ( )S( )N   Corrigido? ( )S( )N      \\n\\n005 - Lubrificar Redutor 2 ponto - guincho aux. - Omala 320 669ml\\nEncontrado problema? ( )S( )N   Corrigido? ( )S( )N      \\n\\n006 - Lubrificar Acoplamentos 3 unidades - guincho aux. - Alvania EP-LF2 790ml\\nEncontrado problema? ( )S( )N   Corrigido? ( )S( )N      \\n\\n007 - Lubrificar Mancal do Dromo - guincho aux. - Alvania EP-LF2 790ml\\nEncontrado problema? ( )S( )N   Corrigido? ( )S( )N      \\n\\n008 - Lubrificar Caixa de Roldanas 3 pontos - guincho aux. - Alvania EP-LF2 790ml\\nEncontrado problema? ( )S( )N   Corrigido? ( )S( )N\\\"\\n\",\"periodicity\":\"\",\"resource\":\"\",\"hh\":\"\"}","annex_act_Y1ZCRAN-LU-ELPC-ELET03":"{\"text\":\"SEM ANEXO\",\"periodicity\":\"\",\"resource\":\"\",\"hh\":\"\"}","annex_act_Y1ZCRAN-LU-ECL261-PR-LUBRI01":"{\"text\":\"1. Qualquer oportunidade detectada durante a execução desta WO deve ser registrada na\\n propria WO para analise \\\"pós trabalho\\\" do encarregado para identificar novas \\nanormalidades, sugestão de melhoria das técnicas e de gestão, e outros.\\n2. Tarefas preditivas que usem padrões de referencia devem ter seus valores registrados.\\n3. Obrigatório responder \\\"Encontrado problema?\\\". No caso de não haver uma resposta será \\nconsiderado como tarefa não realizada.\\n4. Caso seja encontrado problemas, é obrigatório a responder \\\"Corrigido?\\\". No caso de não\\nresposta, será considerado como falha de preenchimento e o encarregado deve reorientar.\\n5. Falhas prematuras decorrentes da má qualidade de execução ou falha no preenchimento \\nsão de responsabilidade do executante.\\nAtividade: 84D 001S-LUBRI LUB001S LUB PONTE ROLANTE - ECL ELETRODOS\\nProcedimento de Referencia: BPAP\\nRevisada por: Allisson Albuquerque, Lana Martins, João Paulo\\nData ultima revisão: 08/01/2014\\nSeq. Tarefa - Ponto - Detalhe Detalhes da conclusão\\n001 - Lubrificar Redutor 2 ponto - guincho prin. - Omala 320 669ml\\nEncontrado problema? ( )S( )N Corrigido? ( )S( )N \\n002 - Lubrificar Acoplamentos 3 unidades - guincho prin. - Alvania EP-LF2 790ml\\nEncontrado problema? ( )S( )N Corrigido? ( )S( )N \\n003 - Lubrificar Mancal do Dromo - guincho prin. - Alvania EP-LF2 790ml\\nEncontrado problema? ( )S( )N Corrigido? ( )S( )N \\n004 - Lubrificar Caixa de Roldanas 3 pontos - guincho prin. - Alvania EP-LF2 790ml\\nEncontrado problema? ( )S( )N Corrigido? ( )S( )N \\n005 - Lubrificar Redutor 2 ponto - guincho aux. - Omala 320 669ml\\nEncontrado problema? ( )S( )N Corrigido? ( )S( )N \\n006 - Lubrificar Acoplamentos 3 unidades - guincho aux. - Alvania EP-LF2 790ml\\n\",\"periodicity\":\"\",\"resource\":\"\",\"hh\":\"\"}","annex_act_Y1ZCRAN-IN-ECL261-PR-141F94":"{\"text\":\"\\\"Orientações:\\n1. Qualquer oportunidade detectada durante a execução desta WO deve ser registrada na\\n propria WO para analise \\\"\\\"pós trabalho\\\"\\\" do encarregado para identificar novas \\nanormalidades, sugestão de melhoria das técnicas e de gestão, e outros.\\n2. Tarefas preditivas que usem padrões de referencia devem ter seus valores registrados.\\n3. Obrigatório responder \\\"\\\"Encontrado problema?\\\"\\\". No caso de não haver uma resposta será \\nconsiderado como tarefa não realizada.\\n4. Caso seja encontrado problemas, é obrigatório a responder \\\"\\\"Corrigido?\\\"\\\". No caso de não\\nresposta, será considerado como falha de preenchimento e o encarregado deve reorientar.\\n5. Falhas prematuras decorrentes da má qualidade de execução ou falha no preenchimento \\nsão de responsabilidade do executante.\\n\\nAtividade: 84D PPSC MEC LUB TRANSLAÇÃO PONTE - ELETRODOS\\nProcedimento de Referencia: BPAP\\nRevisada por: Celio Raposo, Ciro Camelo, Lana Martins, Hugo Farias, Luiz Eduardo\\nData ultima revisão: 26/05/2011\\n\\nSeq. Tarefa - Ponto - Detalhe                                       Detalhes da conclusão\\n001 - Lubrificar Roda Motriz Leste 2 mancais - translação ponte - Alvania EP-LF2 790ml\\nEncontrado problema? ( )S( )N   Corrigido? ( )S( )N   \\n\\n002 - Lubrificar Roda Motriz Oeste 2 mancais - translação ponte - Alvania EP-LF2 790ml\\nEncontrado problema? ( )S( )N   Corrigido? ( )S( )N   \\n\\n003 - Lubrificar Roda Movida Leste 2 mancais - translação ponte - Alvania EP-LF2 790ml\\nEncontrado problema? ( )S( )N   Corrigido? ( )S( )N   \\n\\n004 - Lubrificar Roda Movida Oeste 2 mancais - translação ponte - Alvania EP-LF2 790ml\\nEncontrado problema? ( )S( )N   Corrigido? ( )S( )N   \\n\\n005 - Lubrificar Redutor Leste 1 ponto - translação ponte - Omala 320 669ml\\nEncontrado problema? ( )S( )N   Corrigido? ( )S( )N   \\n\\n006 - Lubrificar Redutor Oeste 1 ponto - translação ponte - Omala 320 669ml\\nEncontrado problema? ( )S( )N   Corrigido? ( )S( )N   \\n\\n007 - Lubrificar 4 Acoplamentos 4 pontos - translação ponte - Omala 230 669ml \\nEncontrado problema? ( )S( )N   Corrigido? ( )S( )N   \\n\\n008 - Lubrificar Roda Guia - translação ponte - alvania EP-LF2 790ml\\nEncontrado problema? ( )S( )N   Corrigido? ( )S( )N\\\"\\n\",\"periodicity\":\"\",\"resource\":\"\",\"hh\":\"\"}","annex_act_Y1ZCRAN-IN-ECL261-PR-141F89":"{\"text\":\"\\\"Orientações:\\n1. Qualquer oportunidade detectada durante a execução desta WO deve ser registrada na\\n propria WO para analise do encarregado - deve ter análise pós trabalho (novas \\nanormalidades, sugestão de melhoria técnicas e de gestão)\\n2. Atividades executadas devem ter seus status avaliados como \\\"\\\"OK\\\"\\\", atividades não\\n executadas devem ter seus status registrados como \\\"\\\"NOK\\\"\\\" e encaminhadas para análise \\ndo encarregado (cancelar ou reprogramar). Atividades que usem um padrão de referencia \\ndevem ter seus valores registrados no campo valor.\\n3. Falhas prematuras decorrentes da má qualidade de execução ou falha nos registros é \\nde responsabilidade do executante.\\n\\nAtividade:                  28D PPSC ELE INSP PREV TRANSLAÇÃO CARRO TREMONHA E TRANSLACAO PONTE - ECL\\nProcedimento de Referencia: BPAP:\\nRevisada por:               Henrique Melo e Mauro Guerra em 11/07/2025\\n\\nLEGENDA STATUS:  \\nOK: Atividade realizada\\nNOK:  Atividade NAO realizada\\nSP: Sem problema - equipamento OK\\n\\nSeq. Tarefa - Ponto - Detalhe                                       Detalhes da conclusão\\n001 - Inspecionar fixação e caixa de ligação do motor - carro tremonha - integro\\n                                                    [(OK)  (NOK)] [(SP)] Valor___________\\n002 - Inspecionar cortina de cabos - carro tremonha - sem avarias\\n                                                    [(OK)  (NOK)] [(SP)] Valor___________\\n003 - Inspecionar cabos elétricos do motor - carro tremonha - integros\\n                                                    [(OK)  (NOK)] [(SP)] Valor___________\\n004 - Inspecionar fixação e caixa de ligação do motor - translação ponte - integro\\n                                                    [(OK)  (NOK)] [(SP)] Valor___________\\n005 - Inspecionar cortina de cabos - translação ponte - sem avarias\\n                                                    [(OK)  (NOK)] [(SP)] Valor___________\\n006 - Inspecionar cabos elétricos do motor - translação ponte - integros\\n                                                    [(OK)  (NOK)] [(SP)] Valor___________\\\"\\n\",\"periodicity\":\"\",\"resource\":\"\",\"hh\":\"\"}","annex_act_Y1ZCRAN-IN-ECL261-PR-141F20":"{\"text\":\"\\\"Orientações:\\n1. Qualquer oportunidade detectada durante a execução desta WO deve ser registrada na\\n propria WO para analise \\\"\\\"pós trabalho\\\"\\\" do encarregado para identificar novas \\nanormalidades, sugestão de melhoria das técnicas e de gestão, e outros.\\n2. Tarefas preditivas que usem padrões de referencia devem ter seus valores registrados.\\n3. Obrigatório responder \\\"\\\"Encontrado problema?\\\"\\\". No caso de não haver uma resposta será \\nconsiderado como tarefa não realizada.\\n4. Caso seja encontrado problemas, é obrigatório a responder \\\"\\\"Corrigido?\\\"\\\". No caso de não\\nresposta, será considerado como falha de preenchimento e o encarregado deve reorientar.\\n5. Falhas prematuras decorrentes da má qualidade de execução ou falha no preenchimento \\nsão de responsabilidade do executante.\\n\\nAtividade: 14D PPSC INSP PREV TESTE INICIAL - ELETRODOS\\nProcedimento de Referencia: BPAP\\nRevisada por: Henrique Melo \\nData ultima revisão: 22/05/2025\\n\\nSeq. Tarefa - Ponto - Detalhe                                      Detalhes da conclusão\\n001 - Testar funcionamento do ar condicionado – Ar condicionado - sem ruído\\nEncontrado problema? ( )S( )N   Corrigido? ( )S( )N \\n002 - Testar funcionamento do compressor – Compressor - pressão de 7 bar\\nEncontrado problema? ( )S( )N   Corrigido? ( )S( )N \\n003 - Executar teste de lâmpdas de sinalização – Cabine - lâmpada acesa\\nEncontrado problema? ( )S( )N   Corrigido? ( )S( )N \\n004 - Testar sirene – Cabine- funcionando\\nEncontrado problema? ( )S( )N   Corrigido? ( )S( )N \\n005 - Testar iluminação interna da cabine – Cabine - lâmpada acesa\\nEncontrado problema? ( )S( )N   Corrigido? ( )S( )N \\n006 - Testar iluminação externa da área de trabalho da ponte – Carro tremonha - lâmpada\\n      acesa\\nEncontrado problema? ( )S( )N   Corrigido? ( )S( )N \\n007 - Testar translação da ponte nas 1a, 2a e 3a velocidades sentidos norte e sul – \\n      Translação ponte - velocidade variável\\nEncontrado problema? ( )S( )N   Corrigido? ( )S( )N \\n008 - Testar frenagem – Translação da ponte - reduzindo velocidade\\nEncontrado problema? ( )S( )N   Corrigido? ( )S( )N \\n009 - Observar folga axial no redutor de translação direito – Translação da ponte - sem \\n      folga\\nEncontrado problema? ( )S( )N   Corrigido? ( )S( )N \\n010 - Observar folga axial no redutor de translação esquerdo – Translação da ponte - sem \\n      folga\\nEncontrado problema? ( )S( )N   Corrigido? ( )S( )N \\n011 - Testar 1a e 2a velocidades da translação do carro tremonha sentido leste e oeste – \\n      Translação carro - velocidade variável\\nEncontrado problema? ( )S( )N   Corrigido? ( )S( )N \\n012 - Testar frenagem – Translação carro - reduzindo velocidade\\nEncontrado problema? ( )S( )N   Corrigido? ( )S( )N \\n013 - Testar limite de redução – Translação carro - reduzindo velocidade\\nEncontrado problema? ( )S( )N   Corrigido? ( )S( )N \\n014 - Testar 1a e 2a velocidades de elevação – Guincho de 5 Ton - movimento em duas\\n      velocidades\\nEncontrado problema? ( )S( )N   Corrigido? ( )S( )N \\n015 - Testar limites – Guincho de 5 Ton - reduzindo velocidade\\nEncontrado problema? ( )S( )N   Corrigido? ( )S( )N \\n016 - Testar 1a e 2a velocidades de elevação – Guincho de 20 Ton - movimento em duas\\n      velocidades\\nEncontrado problema? ( )S( )N   Corrigido? ( )S( )N \\n017 - Testar limites – Guincho de 20 Ton - reduzindo velocidade\\nEncontrado problema? ( )S( )N   Corrigido? ( )S( )N \\n018 - Testar 1a e 2a velocidades de elevação – Descarga de coque - movimento em duas\\n      velocidades\\nEncontrado problema? ( )S( )N   Corrigido? ( )S( )N \\n019 - Testar limites – Descarga de coque - reduzindo velocidade\\nEncontrado problema? ( )S( )N   Corrigido? ( )S( )N \\n020 - Testar 1a e 2a velocidades de elevação – Succionador de coque - movimento em duas\\n      velocidades\\nEncontrado problema? ( )S( )N   Corrigido? ( )S( )N \\n021 - Testar limites – Succionador de coque - reduzindo velocidade\\nEncontrado problema? ( )S( )N   Corrigido? ( )S( )N \\n022 - Testar funcionamento da bomba de vácuo – Bomba de vácuo - motor funcionando\\nEncontrado problema? ( )S( )N   Corrigido? ( )S( )N \\n023 - Testar funcionamento do vacuostato – Bomba de vácuo - 100 a 400 mbar\\nEncontrado problema? ( )S( )N   Corrigido? ( )S( )N \\n024 - Verificar funcionamento dos Termostatos – Bomba de vácuo - 80oC\\nEncontrado problema? ( )S( )N   Corrigido? ( )S( )N \\n025 - Testar funcionamento da limpeza das mangas – Filtro de manga - válvulas abrindo\\nEncontrado problema? ( )S( )N   Corrigido? ( )S( )N \\n026 - Inspecionar estado das mangas, programar troca caso necessário,  – Filtro de manga\\nEncontrado problema? ( )S( )N   Corrigido? ( )S( )N \\n027 - Verificar funcionamento do resfriador do sistema de sucção – Trocador de calor -\\n      motores funcionando\\nEncontrado problema? ( )S( )N   Corrigido? ( )S( )N \\n028 - Testar 1a e 2a velocidades da translação – Carro pinça - movimento nas duas\\n      velocidades\\nEncontrado problema? ( )S( )N   Corrigido? ( )S( )N \\n029 - Testar limite de redução da translação – Carro pinça - reduzindo velocidade\\nEncontrado problema? ( )S( )N   Corrigido? ( )S( )N \\n030 - Testar 1a e 2a velocidades de elevação – Elevação pinça leste - movimento em duas\\n      velocidades\\nEncontrado problema? ( )S( )N   Corrigido? ( )S( )N \\n031 - Testar frenagem de elevação – Pinça leste - reduzindo velocidade\\nEncontrado problema? ( )S( )N   Corrigido? ( )S( )N \\n032 - Testar limite de elevação – Pinça leste - reduzindo velocidade\\nEncontrado problema? ( )S( )N   Corrigido? ( )S( )N \\n033 - Testar abertura – Pinça leste - pinça abrindo\\nEncontrado problema? ( )S( )N   Corrigido? ( )S( )N \\n034 - Testar limite de abertura – Pinça leste - pinça parando\\nEncontrado problema? ( )S( )N   Corrigido? ( )S( )N \\n035 - Testar 1a e 2a velocidades de elevação – Elevação pinça oeste - movimento em duas\\n      velocidades\\nEncontrado problema? ( )S( )N   Corrigido? ( )S( )N \\n036 - Testar frenagem de elevação – Pinça oeste - reduzindo velocidade\\nEncontrado problema? ( )S( )N   Corrigido? ( )S( )N \\n037 - Testar limite de elevação – Pinça oeste - reduzindo velocidade\\nEncontrado problema? ( )S( )N   Corrigido? ( )S( )N \\n038 - Testar abertura – Pinça oeste - Pinça abrindo\\nEncontrado problema? ( )S( )N   Corrigido? ( )S( )N \\n039 - Testar limite de abertura – Pinça oeste - pinça parando\\nEncontrado problema? ( )S( )N   Corrigido? ( )S( )N \\n040 - Checar condições da manete – Cabine - sem travar\\nEncontrado problema? ( )S( )N   Corrigido? ( )S( )N\\\"\\n\",\"periodicity\":\"\",\"resource\":\"\",\"hh\":\"\"}","annex_act_Y1ZCRAN-IN-ECL261-PR-141F95":"{\"text\":\"\\\"Orientações:\\n1. Qualquer oportunidade detectada durante a execução desta WO deve ser registrada na\\n propria WO para analise \\\"\\\"pós trabalho\\\"\\\" do encarregado para identificar novas \\nanormalidades, sugestão de melhoria das técnicas e de gestão, e outros.\\n2. Tarefas preditivas que usem padrões de referencia devem ter seus valores registrados.\\n3. Obrigatório responder \\\"\\\"Encontrado problema?\\\"\\\". No caso de não haver uma resposta será \\nconsiderado como tarefa não realizada.\\n4. Caso seja encontrado problemas, é obrigatório a responder \\\"\\\"Corrigido?\\\"\\\". No caso de não\\nresposta, será considerado como falha de preenchimento e o encarregado deve reorientar.\\n5. Falhas prematuras decorrentes da má qualidade de execução ou falha no preenchimento \\nsão de responsabilidade do executante.\\n\\nAtividade: 84D PPSC MEC LUB TRANSLAÇÃO CARRO - ELETRODOS\\nProcedimento de Referencia: BPAP\\nRevisada por: Celio Raposo, Ciro Camelo, Lana Martins, Hugo Farias, Luiz Eduardo\\nData ultima revisão: 26/05/2011\\n\\nSeq. Tarefa - Ponto - Detalhe                                       Detalhes da conclusão\\n001 - Lubrificar Roda Motriz Norte 2 mancais - translação carro - Alvania EP-LF2 790ml\\nEncontrado problema? ( )S( )N   Corrigido? ( )S( )N       \\n\\n002 - Lubrificar Roda Motriz Sul 2 mancais - translação carro - Alvania EP-LF2 790ml\\nEncontrado problema? ( )S( )N   Corrigido? ( )S( )N       \\n\\n003 - Lubrificar Roda Movida Norte 2 mancais - translação carro - Alvania EP-LF2 790ml\\nEncontrado problema? ( )S( )N   Corrigido? ( )S( )N       \\n\\n004 - Lubrificar Roda Movida Sul 2 mancais - translação carro - Alvania EP-LF2 790ml\\nEncontrado problema? ( )S( )N   Corrigido? ( )S( )N       \\n\\n005 - Lubrificar Redutor Central 1 ponto - translação carro - Omala 320 669ml\\nEncontrado problema? ( )S( )N   Corrigido? ( )S( )N       \\n\\n006 - Lubrificar Roda Guia Inferior 2 mancais - translação carro - Alvania EP-LF2 790ml\\nEncontrado problema? ( )S( )N   Corrigido? ( )S( )N       \\n\\n007 - Lubrificar Roda Guia Superior 2 mancais - translação carro - Alvania EP-LF2 790ml\\nEncontrado problema? ( )S( )N   Corrigido? ( )S( )N\\\"\\n\",\"periodicity\":\"\",\"resource\":\"\",\"hh\":\"\"}","annex_act_Y1ZCRAN-IN-ECL261-PR-141F80":"{\"text\":\"\\\"Orientacoes:\\n1. Qualquer oportunidade detectada durante a execução desta WO deve ser registrada na\\n propria WO para analise do encarregado -  análise pós trabalho (novas \\nanormalidades, sugestão de melhoria técnicas e de gestão)\\n2. Atividades executadas devem ter seus status avaliados como \\\"\\\"OK\\\"\\\", atividades não\\n executadas devem ter seus status registrados como \\\"\\\"NOK\\\"\\\" e encaminhadas para análise \\ndo encarregado (cancelar ou reprogramar). Atividades que usem um padrão de referencia \\ndevem ter seus valores registrados no campo valor.\\n3. Falhas prematuras decorrentes da má qualidade de execução ou falha nos registros é \\nde responsabilidade do executante.\\n\\nAtividade:                  28D PPSC MEC INSP COMPRESSORES GA 30 \\nProcedimento de Referencia: BPAP:\\nRevisada por:               Giovanni Lima, Celio Raposo, Ciro Camelo, Roberto Marques, \\n                            Lana Martins e Hugo Farias em 23/07/2010\\nLEGENDA STATUS:  \\nOK: Atividade realizada\\nNOK:  Atividade NAO realizada\\nSP: Sem problema - equipamento OK\\n\\nSeq. Tarefa - Ponto - Detalhe                                       Detalhes da conclusão\\n001  Inspecionar radiador - Compressor - Sem folga, sem furo\\n                                                    [(OK)  (NOK)] [(SP)] Valor___________\\n002  Inspecionar nivel de oleo - Compressor - escala no visor de nivel intermediario\\n                                                    [(OK)  (NOK)] [(SP)] Valor___________\\n003  Inspecionar filtro de oleo - Compressor - limpo sem deformacao\\n                                                    [(OK)  (NOK)] [(SP)] Valor___________\\n004  Inspecionar filtro de oleo de linha- Compressor - limpo sem deformacao\\n                                                    [(OK)  (NOK)] [(SP)] Valor___________\\n005  Inspecionar filtro de oleo de abastecimento - Compressor - limpo sem deformacao\\n                                                    [(OK)  (NOK)] [(SP)] Valor___________\\n006  Inspecionar filtro de ar - Compressor - limpo sem deformacao\\n                                                    [(OK)  (NOK)] [(SP)] Valor___________\\n007  Inspecionar elemento separador - Compressor - sem trinca / sem folga\\n                                                    [(OK)  (NOK)] [(SP)] Valor___________\\n008  Inspecionar copo do condensador - Compressor - sem trinca / sem deformacao\\n                                                    [(OK)  (NOK)] [(SP)] Valor___________\\n009  Inspecionar valvula de admissao - Compressor - sem trinca / sem deformacao\\n                                                    [(OK)  (NOK)] [(SP)] Valor___________\\n010  Inspecionar conj das valvulas Y1 e Y2 - Compressor - sem folga / funcionando\\n                                                    [(OK)  (NOK)] [(SP)] Valor___________\\n011  Inspecionar mangueiras da instrumentacao - Compressor - sem deformacao / sem folga\\n                                                    [(OK)  (NOK)] [(SP)] Valor___________\\n012  Inspecionar manometro - Compressor - funcionamento / sem folga\\n                                                    [(OK)  (NOK)] [(SP)] Valor___________\\n013  Inspecionar pressostato - Compressor - funcionamento / sem folga\\n                                                    [(OK)  (NOK)] [(SP)] Valor___________\\n014  Inspecionar manometro do vaso de pressão - Compressor - funcionamento / sem folga\\n                                                    [(OK)  (NOK)] [(SP)] Valor___________\\n015  Inspecionar pressostato do vaso de pressão- Compressor - funcionamento / sem folga\\n                                                    [(OK)  (NOK)] [(SP)] Valor___________\\n016  Inspecionar vaso de pressão - Compressor - Sem sinais de danos na estrutura\\n                                                    [(OK)  (NOK)] [(SP)] Valor___________\\n\\\"\\n\",\"periodicity\":\"\",\"resource\":\"\",\"hh\":\"\"}","annex_act_Y1ZCRAN-IN-ECL261-PR-141F41":"{\"text\":\"1. Qualquer oportunidade detectada durante a execução desta WO deve ser registrada na\\n propria WO para analise do encarregado - deve ter análise pós trabalho (novas \\nanormalidades, sugestão de melhoria técnicas e de gestão)\\n2. Atividades executadas devem ter seus status avaliados como \\\"OK\\\", atividades não\\n executadas devem ter seus status registrados como \\\"NOK\\\" e encaminhadas para análise \\ndo encarregado (cancelar ou reprogramar). Atividades que usem um padrão de referencia \\ndevem ter seus valores registrados no campo valor.\\n3. Falhas prematuras decorrentes da má qualidade de execução ou falha nos registros é \\nde responsabilidade do executante.\\nAtividade: 56D PPSC MEC INSP PREV FERRAMENTA PINÇA - ELETRODOS\\nProcedimento de Referencia: BPAP:\\nRevisada por: Henrique Melo em 23/05/2025\\nLEGENDA STATUS: \\nOK: Atividade realizada\\nNOK: Atividade NAO realizada\\nSP: Sem problema - equipamento OK\\nSeq. Tarefa - Ponto - Detalhe Detalhes da conclusão\\n001 - Insp. Pinos da pinça oeste - pinça oeste - sem desgaste\\n [(OK) (NOK)] Valor___________\\n002 - Insp. Pinos da pinça leste - pinça leste - sem desgaste\\n [(OK) (NOK)] Valor___________\\n003 - insp. Parafusos de Fixação - Tubo Movel - sem folga\\n [(OK) (NOK)] Valor___________\\n004 - insp. Chapa trava - torpedo da pinça - sem folga\\n [(OK) (NOK)] Valor___________\\n005 - insp. Rolo guia - Pinça - integridade\",\"periodicity\":\"\",\"resource\":\"\",\"hh\":\"\"}","annex_act_Y1ZCRAN-IN-ECL261-PR-141F45":"{\"text\":\"\\\"Orientacoes:\\n1. Qualquer oportunidade detectada durante a execução desta WO deve ser registrada na\\n propria WO para analise do encarregado - deve ter análise pós trabalho (novas \\nanormalidades, sugestão de melhoria técnicas e de gestão)\\n2. Atividades executadas devem ter seus status avaliados como \\\"\\\"OK\\\"\\\", atividades não\\n executadas devem ter seus status registrados como \\\"\\\"NOK\\\"\\\" e encaminhadas para análise \\ndo encarregado (cancelar ou reprogramar). Atividades que usem um padrão de referencia \\ndevem ter seus valores registrados no campo valor.\\n3. Falhas prematuras decorrentes da má qualidade de execução ou falha nos registros é \\nde responsabilidade do executante.\\n\\nAtividade:                  28D PPSC MEC PREV TRANSLAÇÃO CARRO TREMONHA - ELETRODOS\\nProcedimento de Referencia: BPAP:\\nRevisada por:               Giovanni Lima, Celio Raposo, Ciro Camelo, Roberto Marques, \\n                            Lana Martins e Hugo Farias em 23/07/2010\\nLEGENDA STATUS:  \\nOK: Atividade realizada\\nNOK:  Atividade NAO realizada\\nSP: Sem problema - equipamento OK\\n\\nSeq. Tarefa - Ponto - Detalhe                                       Detalhes da conclusão\\n001 - Insp. parafusos de fixação - carro tremonha trans. Norte truck - sem folga\\n                                                           [(OK)  (NOK)] Valor___________\\n002 - Insp. parafusos de fixação - carro tremonha trans. Sul truck - sem folga\\n                                                           [(OK)  (NOK)] Valor___________\\n003 - Insp. Acoplamento e elemento elástico - Motor/redutor trans. N truck - sem folga\\n                                                           [(OK)  (NOK)] Valor___________\\n004 - Insp. Acoplamento e elemento elástico - Motor/redutor trans. S truck - sem folga\\n                                                           [(OK)  (NOK)] Valor___________\\n005 - Insp. Pastilha de freio - Freio Leste - sem folga e desgaste\\n                                                           [(OK)  (NOK)] Valor___________\\n006 - Insp. Pastilha de freio - Freio Oeste - sem folga e desgaste\\n                                                           [(OK)  (NOK)] Valor___________\\n007 - Insp. Nível de óleo - redutor Leste - atingir nível padrão do visor\\n                                                           [(OK)  (NOK)] Valor___________\\n008 - Insp. Nível de óleo - redutor Oeste - atingir nível padrão do visor\\n                                                           [(OK)  (NOK)] Valor___________\\n009 - Insp. Roda guia - carro tremonha Norte - sem folga e trinca\\n                                                           [(OK)  (NOK)] Valor___________\\n010 - Insp. Roda guia - carro tremonha Sul - sem folga e trinca\\n                                                           [(OK)  (NOK)] Valor___________\\n011 - Insp. Roda motriz - carro tremonha Norte - sem folga e trinca\\n                                                           [(OK)  (NOK)] Valor___________\\n012 - Insp. Roda motriz - carro tremonha Sul - sem folga e trinca\\n                                                           [(OK)  (NOK)] Valor___________\\n013 - Insp. Roda movida - carro tremonha Norte - sem folga e trinca\\n                                                           [(OK)  (NOK)] Valor___________\\n014 - Insp. Roda movida - carro tremonha Sul - sem folga e trinca\\n                                                           [(OK)  (NOK)] Valor___________\\n015 - Insp. Valvula do Sopro de Trilho - Limpa trilho - funcionando\\n                                                    [(OK)  (NOK)] [(SP)] Valor___________\\n016 - Insp. Direção do Sopro de trilho - Limpa Trilho - Direcionada para o trilho\\n                                                    [(OK)  (NOK)] [(SP)] Valor___________\\n017 - Insp. Tubo do sopro de trilho - Limpa Trilho - Desobistruido\\n                                                    [(OK)  (NOK)] [(SP)] Valor___________\\\"\\n\",\"periodicity\":\"\",\"resource\":\"\",\"hh\":\"\"}","annex_act_Y1ZCRAN-IN-ECL261-PR-261001":"{\"text\":\"\\\"EAM: Y1ZCRAN-IN-ECL261-PR-141F99\\n\\nTEXTO\\nOrientações:\\n1. Qualquer oportunidade detectada durante a execução desta WO deve ser registrada na\\n propria WO para analise \\\"\\\"pós trabalho\\\"\\\" do encarregado para identificar novas \\nanormalidades, sugestão de melhoria das técnicas e de gestão, e outros.\\n2. Tarefas preditivas que usem padrões de referencia devem ter seus valores registrados.\\n3. Obrigatório responder \\\"\\\"Encontrado problema?\\\"\\\". No caso de não haver uma resposta será \\nconsiderado como tarefa não realizada.\\n4. Caso seja encontrado problemas, é obrigatório a responder \\\"\\\"Ação?\\\"\\\". No caso de não\\nresposta, será considerado como falha de preenchimento e o encarregado deve reorientar.\\n5. Falhas prematuras decorrentes da má qualidade de execução ou falha no preenchimento \\nsão de responsabilidade do executante.\\n\\n\\nATIVIDADE: 14D MANUT ELET INSP PREV PINCA LESTE E OESTE - PONTES 261 E 262\\nProcedimento de Referência: LACDM 4001625\\nRevisada por:  Suzy Amaral, Jairon Martins, Aysla Oliveira.\\nData última revisão: 10/01/2023\\n\\n\\n\\nSeq. - Tarefa - Ponto de Checagem - Detalhes da Execução\\n\\n001 - Verificar Limite de Abertura - Pinça Leste - Limpeza, reaperto, integridade do componente, sem travamentos\\nEncontrado problema? (   )S  (   )N   _______________________________________\\nAção? (   ) WO FOLLOW UP    (   ) CORREÇÃO    (  ) TROCA  ___________________\\n                                                                               \\n003 - Verificar Limite de Fechamento - Pinça Leste - Limpeza, reaperto, integridade do componente, sem travamentos\\nEncontrado problema? (   )S  (   )N   _______________________________________\\nAção? (   ) WO FOLLOW UP    (   ) CORREÇÃO    (  ) TROCA  ___________________\\n                                                                                                                                                            \\n004 - Verificar Limite de Cames - Pinça Leste - Limpeza, reaperto, integridade do componente, sem travamentos\\nEncontrado problema? (   )S  (   )N   _______________________________________\\nAção? (   ) WO FOLLOW UP    (   ) CORREÇÃO    (  ) TROCA  ___________________\\n                                                                                                                                                            \\n005 - Verificar Limite de Cabo Frouxo Superior - Pinça Leste - Limpeza, reaperto, integridade do componente, sem travamentos\\nEncontrado problema? (   )S  (   )N   _______________________________________\\nAção? (   ) WO FOLLOW UP    (   ) CORREÇÃO    (  ) TROCA  ___________________\\n\\n006 - Verificar Limite de Cabo Frouxo Inferior - Pinça Leste - Limpeza, reaperto, integridade do componente, sem travamentos\\nEncontrado problema? (   )S  (   )N   _______________________________________\\nAção? (   ) WO FOLLOW UP    (   ) CORREÇÃO    (  ) TROCA  ___________________     \\n\\n007 - Verificar Limite de Emergência - Pinça Leste - Limpeza, reaperto, integridade do componente, sem travamentos\\nEncontrado problema? (   )S  (   )N   _______________________________________\\nAção? (   ) WO FOLLOW UP    (   ) CORREÇÃO    (  ) TROCA  ___________________                                                                                                                                                       \\n                                                                           \\n008 - Verificar Limite de Abertura - Pinça Oeste - Limpeza, reaperto, integridade do componente, sem travamentos\\nEncontrado problema? (   )S  (   )N   _______________________________________\\nAção? (   ) WO FOLLOW UP    (   ) CORREÇÃO    (  ) TROCA  ___________________\\n                                                                               \\n009 - Verificar Limite de Fechamento - Pinça Oeste - Limpeza, reaperto, integridade do componente, sem travamentos\\nEncontrado problema? (   )S  (   )N   _______________________________________\\nAção? (   ) WO FOLLOW UP    (   ) CORREÇÃO    (  ) TROCA  ___________________\\n                                                                                                                                                            \\n010 - Verificar Limite de Cames - Pinça Oeste - Limpeza, reaperto, integridade do componente, sem travamentos\\nEncontrado problema? (   )S  (   )N   _______________________________________\\nAção? (   ) WO FOLLOW UP    (   ) CORREÇÃO    (  ) TROCA  ___________________\\n                                                                                                                                                            \\n011 - Verificar Limite de Cabo Frouxo Superior - Pinça Oeste - Limpeza, reaperto, integridade do componente, sem travamentos\\nEncontrado problema? (   )S  (   )N   _______________________________________\\nAção? (   ) WO FOLLOW UP    (   ) CORREÇÃO    (  ) TROCA  ___________________\\n\\n012 - Verificar Limite de Cabo Frouxo Inferior - Pinça Oeste - Limpeza, reaperto, integridade do componente, sem travamentos\\nEncontrado problema? (   )S  (   )N   _______________________________________\\nAção? (   ) WO FOLLOW UP    (   ) CORREÇÃO    (  ) TROCA  ___________________     \\n\\n013 - Verificar Limite de Emergência - Pinça Oeste - Limpeza, reaperto, integridade do componente, sem travamentos\\nEncontrado problema? (   )S  (   )N   _______________________________________\\nAção? (   ) WO FOLLOW UP    (   ) CORREÇÃO    (  ) TROCA  ___________________                                                                                                                                                       \\n\\n\\n-----------------------------------------------------------------------------------\\nPAINEL DA PINÇA\\n\\n1       Verificar contatores de forca e comando.painel N4 - Translacao carro pinca          \\nEncontrado problema? (   )S  (   )N   _________________________________________\\nAção? (   ) WO FOLLOW UP    (   ) CORREÇÃO    (  ) TROCA  _____________________\\n             \\n2      Testar limites SF 41,42 - Translacao carro pinca                       \\nEncontrado problema? (   )S  (   )N   _________________________________________\\nAção? (   ) WO FOLLOW UP    (   ) CORREÇÃO    (  ) TROCA  _____________________\\n3      Testar botao de emergencia SB39 e 51 - Translacao carro pinca                       \\nEncontrado problema? (   )S  (   )N   _________________________________________\\nAção? (   ) WO FOLLOW UP    (   ) CORREÇÃO    (  ) TROCA  _____________________\\n\\n4       Verificar fixação do contator km63,64,65,66,67 - Translacao carro pinca                       \\nEncontrado problema? (   )S  (   )N   _________________________________________\\nAção? (   ) WO FOLLOW UP    (   ) CORREÇÃO    (  ) TROCA  _____________________\\n\\n5       Verificar fixacao do contator km68,69,70,71 - Translacao carro pinca                       \\nEncontrado problema? (   )S  (   )N   _________________________________________\\nAção? (   ) WO FOLLOW UP    (   ) CORREÇÃO    (  ) TROCA  _____________________\\n\\n6    Verificar fixacao conexão do fusíveis F79,82,83,80,81,114 - Translacao carro pinca                       \\nEncontrado problema? (   )S  (   )N   _________________________________________\\nAção? (   ) WO FOLLOW UP    (   ) CORREÇÃO    (  ) TROCA  _____________________\\n\\n7      Verificar fixacao base de parafuso de ajuste de fusíveis F114- Translacao carro pinca                       \\nEncontrado problema? (   )S  (   )N   _________________________________________\\nAção? (   ) WO FOLLOW UP    (   ) CORREÇÃO    (  ) TROCA  _____________________\\n\\n8      Verificar fixacao base parafuso de ajuste de fusíveis F79 - Translacao carro pinca                       \\nEncontrado problema? (   )S  (   )N   _________________________________________\\nAção? (   ) WO FOLLOW UP    (   ) CORREÇÃO    (  ) TROCA  _____________________\\n\\n9      Verificar fixacao base parafuso de ajuste de fusiveis F80 - Translacao carro pinca                       \\nEncontrado problema? (   )S  (   )N   _________________________________________\\nAção? (   ) WO FOLLOW UP    (   ) CORREÇÃO    (  ) TROCA  _____________________\\n\\n10     Verificar fixacao base parafuso de ajuste de fusiveis F81 - Translacao carro pinca                       \\nEncontrado problema? (   )S  (   )N   _________________________________________\\nAção? (   ) WO FOLLOW UP    (   ) CORREÇÃO    (  ) TROCA  _____________________\\n\\n11     Verificar fixacao base parafuso de ajuste de fusiveis F82 - Translacao carro pinca                       \\nEncontrado problema? (   )S  (   )N   _________________________________________\\nAção? (   ) WO FOLLOW UP    (   ) CORREÇÃO    (  ) TROCA  _____________________\\n\\n12     Verificar fixacao base parafuso de ajuste de fusiveis F83 - Translacao carro pinca                       \\nEncontrado problema? (   )S  (   )N   _________________________________________\\nAção? (   ) WO FOLLOW UP    (   ) CORREÇÃO    (  ) TROCA  _____________________\\n\\n13     Verificar fixacao da conexao do rele terminal F129- Translacao carro pinca                       \\nEncontrado problema? (   )S  (   )N   _________________________________________\\nAção? (   ) WO FOLLOW UP    (   ) CORREÇÃO    (  ) TROCA  _____________________\\n\\n14     Verificar fixacao da conexao do rele sondaF128 - Translacao carro pinca                       \\nEncontrado problema? (   )S  (   )N   _________________________________________\\nAção? (   ) WO FOLLOW UP    (   ) CORREÇÃO    (  ) TROCA  _____________________\\n\\n15     Verificar fixacao da conexao ponte retificador V9- Translacao carro pinca                       \\nEncontrado problema? (   )S  (   )N   _________________________________________\\nAção? (   ) WO FOLLOW UP    (   ) CORREÇÃO    (  ) TROCA  _____________________\\n\\n16     Verificar fixacao da conexao do contator Ka93  - Translacao carro pinca                       \\nEncontrado problema? (   )S  (   )N   _________________________________________\\nAção? (   ) WO FOLLOW UP    (   ) CORREÇÃO    (  ) TROCA  _____________________\\n\\n17     Verificar fixacao da conexao do contator Ka94  - Translacao carro pinca                       \\nEncontrado problema? (   )S  (   )N   _________________________________________\\nAção? (   ) WO FOLLOW UP    (   ) CORREÇÃO    (  ) TROCA  _____________________\\n\\n18     Verificar fixacao da conexao do contator Ka95  - Translacao carro pinca                       \\nEncontrado problema? (   )S  (   )N   _________________________________________\\nAção? (   ) WO FOLLOW UP    (   ) CORREÇÃO    (  ) TROCA  _____________________\\n\\n19     Verificar fixacao da conexao do contator Ka96, Ka97, Ka98, Ka99, Ka101, Ka 131 - Translacao carro pinca                       \\nEncontrado problema? (   )S  (   )N   _________________________________________\\nAção? (   ) WO FOLLOW UP    (   ) CORREÇÃO    (  ) TROCA  _____________________\\n\\n29     Verificar  fixacao da regua de borne  - Translacao carro pinca                      \\nEncontrado problema? (   )S  (   )N   _________________________________________\\nAção? (   ) WO FOLLOW UP    (   ) CORREÇÃO    (  ) TROCA  _____________________\\n\\n31      Verificar cabos alimen.recep.lumin.lamp.das pincas  - Translacao carro pinca                       \\nEncontrado problema? (   )S  (   )N   _________________________________________\\nAção? (   ) WO FOLLOW UP    (   ) CORREÇÃO    (  ) TROCA  _____________________\\n\\n32      Verificar fixacao das lampadas de iluminacao.das pincas - Translacao carro pinca    \\nEncontrado problema? (   )S  (   )N   _________________________________________\\nAção? (   ) WO FOLLOW UP    (   ) CORREÇÃO    (  ) TROCA  _____________________\\n\\n33      Reapertar parafusos de fixação da biela do redutor de abertura da pinça, garantir pré torque - Abertura Pinça   \\nEncontrado problema? (   )S  (   )N   _________________________________________\\nAção? (   ) WO FOLLOW UP    (   ) CORREÇÃO    (  ) TROCA  _____________________\\n                                                                                                                                       \\n34      Reapertar parafusos da base do redutor de abertura da pinça, garantir pré torque - Abertura Pinça   \\nEncontrado problema? (   )S  (   )N   _________________________________________\\nAção? (   ) WO FOLLOW UP    (   ) CORREÇÃO    (  ) TROCA  _____________________\\\"\\n\",\"periodicity\":\"\",\"resource\":\"\",\"hh\":\"\"}","annex_act_Y1ZCRAN-IN-ECL261-PR-261009":"{\"text\":\"\\\"TEXTO\\nOrientações:\\n1. Qualquer oportunidade detectada durante a execução desta WO deve ser registrada na\\n propria WO para analise \\\"\\\"pós trabalho\\\"\\\" do encarregado para identificar novas \\nanormalidades, sugestão de melhoria das técnicas e de gestão, e outros.\\n2. Tarefas preditivas que usem padrões de referencia devem ter seus valores registrados.\\n3. Obrigatório responder \\\"\\\"Encontrado problema?\\\"\\\". No caso de não haver uma resposta será \\nconsiderado como tarefa não realizada.\\n4. Caso seja encontrado problemas, é obrigatório a responder \\\"\\\"Ação?\\\"\\\". No caso de não\\nresposta, será considerado como falha de preenchimento e o encarregado deve reorientar.\\n5. Falhas prematuras decorrentes da má qualidade de execução ou falha no preenchimento \\nsão de responsabilidade do executante.\\n\\nATIVIDADE: 28D MANUT ELET PREV DO PANTÓGRAFO - PONTES 261 E 262 (REV23)\\nProcedimento de Referência: LACDM \\nRevisada por:  Suzy Amaral, Jairon Martins, Aysla Oliveira.\\nData última revisão: 10/01/2023\\n\\nSeq. Tarefa - Ponto - Detalhe                                       Detalhes da conclusão\\n\\n001 - Verificar a Integridade do Pantógrafos - pantógrafos - padrão integro\\nEncontrado problema? (  )S  (   )N   _______________________________________\\nAção? (   ) WO FOLLOW UP    (   ) CORREÇÃO    (  ) TROCA  ___________________\\n\\n003 – Reapertar as  Conexões elétricas - conexões - sem folgas\\nEncontrado problema? (   )S  (   )N   _______________________________________\\nAção? (   ) WO FOLLOW UP    (   ) CORREÇÃO    (  ) TROCA  ___________________\\n\\n004 - Verificar a integridade das Molas das escovas - pantógrafos - verificar se a fixação está firme, fazer teste de pressão na mola, puxar porta escova e deve retornar ao local.\\nEncontrado problema? (   )S  (   )N   _______________________________________\\nAção? (   ) WO FOLLOW UP    (   ) CORREÇÃO    (  ) TROCA  ___________________\\n\\n005 - Verificar a integridade das Escovas - pantógrafos - sem desgaste, sem ponto de corrosão\\nEncontrado problema? (   )S  (   )N   _______________________________________\\nAção? (   ) WO FOLLOW UP    (   ) CORREÇÃO    (  ) TROCA  ___________________\\n\\n005 - Verificar a integridade da articulação do porta escova - pantógrafos - não pode estar quebrada\\nEncontrado problema? (   )S  (   )N   _______________________________________\\nAção? (   ) WO FOLLOW UP    (   ) CORREÇÃO    (  ) TROCA  ___________________\\n\\n006 - Verificar a integridade dos Cabos elétricos - pantógrafos – isolação em plenas condições, sem cobre exposto, sem remendos\\nEncontrado problema? (   )S  (   )N   _______________________________________\\nAção? (   ) WO FOLLOW UP    (   ) CORREÇÃO    (  ) TROCA  ___________________\\n\\n006 - Verificar a integridade dos Cabos elétricos - pantógrafos – amarração dos cabos não podem estar soltos.\\nEncontrado problema? (   )S  (   )N   _______________________________________\\nAção? (   ) WO FOLLOW UP    (   ) CORREÇÃO    (  ) TROCA  ___________________\\n\\n007 - Verificar alinhamento do pantógrafo com relação ao barramento – deve estar completamente alinhado, em paralelo sem nenhuma oportunidade de angulação.\\nEncontrado problema? (   )S  (   )N   _______________________________________\\nAção? (   ) WO FOLLOW UP    (   ) CORREÇÃO    (  ) TROCA  ___________________ \\n\\\"\\n\",\"periodicity\":\"\",\"resource\":\"\",\"hh\":\"\"}","annex_act_Y1ZCRAN-ELPC-261-PR-001-141F96":"{\"text\":\"\\\"Orientações:\\n1. Qualquer oportunidade detectada durante a execução desta WO deve ser registrada na\\n propria WO para analise \\\"\\\"pós trabalho\\\"\\\" do encarregado para identificar novas \\nanormalidades, sugestão de melhoria das técnicas e de gestão, e outros.\\n2. Tarefas preditivas que usem padrões de referencia devem ter seus valores registrados.\\n3. Obrigatório responder \\\"\\\"Encontrado problema?\\\"\\\". No caso de não haver uma resposta será \\nconsiderado como tarefa não realizada.\\n4. Caso seja encontrado problemas, é obrigatório a responder \\\"\\\"Corrigido?\\\"\\\". No caso de não\\nresposta, será considerado como falha de preenchimento e o encarregado deve reorientar.\\n5. Falhas prematuras decorrentes da má qualidade de execução ou falha no preenchimento \\nsão de responsabilidade do executante.\\n\\nAtividade: 84D PPSC MEC LUB TRANSLAÇÃO PINÇA - ELETRODOS\\nProcedimento de Referencia: BPAP\\nRevisada por: Celio Raposo, Ciro Camelo, Lana Martins, Hugo Farias, Luiz Eduardo\\nData ultima revisão: 26/05/2011\\n\\nSeq. Tarefa - Ponto - Detalhe                                       Detalhes da conclusão\\n001 - Lubrificar Roda Motriz Norte 2 mancais - translação carro - Alvania EP-LF2 790ml\\nEncontrado problema? ( )S( )N   Corrigido? ( )S( )N \\n\\n002 - Lubrificar Roda Motriz Sul 2 mancais - translação carro - Alvania EP-LF2 790ml\\nEncontrado problema? ( )S( )N   Corrigido? ( )S( )N \\n\\n003 - Lubrificar Roda Movida Norte 2 mancais - translação carro - Alvania EP-LF2 790ml\\nEncontrado problema? ( )S( )N   Corrigido? ( )S( )N \\n\\n004 - Lubrificar Roda Movida S